event_id_cnty,event_date,year,disorder_type,event_type,sub_event_type,iso,region,country,admin1,admin2,location,latitude,longitude,source,notes,fatalities,adm2_code,adm2_name,data_as_of,run_date
MEX94837,2024-10-26,2024,Political violence,Violence against civilians,Attack,484,North America,Mexico,Morelos,Tlaquiltenango,Tlaquiltenango,18.63,-99.1627,Diario de Morelos,"On 26 October 2024, in Tlaquiltenango, Morelos, two armed individuals shot and killed a man drinking alcoholic beverages in Colonia Centro. The man died as a result in a hospital in Jojutla. 1 fatality.",1,MX17025,Tlaquiltenango,2024-12-13,2025-12-13
MEX94845,2024-10-26,2024,Political violence,Battles,Armed clash,484,North America,Mexico,Sinaloa,Culiacan,Campo Eureka,24.4914,-107.423,El Sol de Sinaloa,"On 26 October 2024, close to Campo Eureka, Sinaloa, armed groups engaged in an armed clash. There were no injuries.",0,MX25006,Culiacán,2024-12-13,2025-12-13
MEX94853,2024-10-26,2024,Political violence,Violence against civilians,Attack,484,North America,Mexico,Tabasco,Centro,Villahermosa,17.9878,-92.9194,Tabasco Hoy,"On 26 October 2024, in Villahermosa, Tabasco, unknown armed individuals opened fire and shot at seven off-duty state police officers in Colonia Indeco. Four were killed and three were injured as a result. 4 fatalities, 3 injuries.",4,MX27004,Centro,2024-12-13,2025-12-13
MEX94855,2024-10-26,2024,Political violence,Violence against civilians,Attack,484,North America,Mexico,Zacatecas,Fresnillo,Fresnillo,23.1749,-102.8682,Pagina 24 Zacatecas,"On 26 October 2024, in Fresnillo, Zacatecas, at least two armed men chased and opened fire from a moving car (drive-by) at least four people in a vehicle, including the queen of the Fresnillo fair close to Colonia Benito Juarez. Two men were arrested as a result and there were no injuries.",0,MX32010,Fresnillo,2024-12-13,2025-12-13
MEX94856,2024-10-27,2024,Political violence,Violence against civilians,Attack,484,North America,Mexico,Baja California,Mexicali,Mexicali,32.6412,-115.476,Zeta Tijuana,"On 27 October 2024, in Mexicali, Baja California, two men on a motorcycle opened fire at a man in Colonia Vista del Valle and then fled the scene (drive-by). The man was injured as a result. 1 injury.",0,MX02002,Mexicali,2024-12-13,2025-12-13
MEX94857,2024-10-27,2024,Political violence,Battles,Armed clash,484,North America,Mexico,Campeche,Champoton,Champoton,19.3474,-90.7203,Tribuna Campeche,"On 27 October 2024, in Champoton, Campeche, armed individuals on a motorcycle opened fire (drive-by) and shot a man driving on a motorcycle with his wife on the Ciudad del Sol-La Joya state highway. The man was killed as a result. The victim is suspected to be linked to the sale of drugs. 1 fatality.",1,MX04004,Champotón,2024-12-13,2025-12-13
MEX94858,2024-10-27,2024,Political violence,Violence against civilians,Attack,484,North America,Mexico,Chihuahua,Chihuahua,Chihuahua,28.6368,-106.0763,Tiempo,"On 27 October 2024, in Chihuahua, Chihuahua, two armed men shot and killed a man in Colonia Revolucion. 1 fatality.",1,MX08019,Chihuahua,2024-12-13,2025-12-13
MEX94859,2024-10-27,2024,Political violence,Battles,Armed clash,484,North America,Mexico,Ciudad de Mexico,Cuauhtemoc,Ciudad de Mexico - Cuauhtemoc,19.4313,-99.1531,Reforma,"On 27 October 2024, in Ciudad de Mexico - Cuauhtemoc, armed individuals on a van shot and injured a municipal police officer in the intersection of Los Misterios and La Ronda streets, in Colonia Ex Hipodromo Peralvillo (drive-by). The perpetrators were later arrested in Colonia Jardin Azpeitia, Azcapotzalco. 1 injured.",0,MX09015,Cuauhtémoc,2024-12-13,2025-12-13
MEX94867,2024-10-27,2024,Political violence,Battles,Armed clash,484,North America,Mexico,Guerrero,Atlixtac,San Pedro Huitzapula Norte,17.4268,-98.8066,El Sol de Acapulco,"On 27 October 2024, in San Pedro Huitzapula Norte, Guerrero, members of the community police of Zapotitlan Tablas attacked residents during a meeting at the municipal police station where residents demanded the return of two people who were kidnapped by the community police. One person died, four were injured and one person was missing after the attack. The whereabouts of the missing victim are unknown. 1 fatality, 4 injuries.",1,MX12010,Atlixtac,2024-12-13,2025-12-13
MEX94868,2024-10-27,2024,Political violence,Battles,Armed clash,484,North America,Mexico,Guerrero,Tecoanapa,El Limon,16.9956,-99.3774,Milenio; Reforma,"Around 27 October 2024 (as reported), in El Limon, Guerrero, four people were killed and their bodies were found. Three of the bodies were tied and were wrapped in blankets on the Las Parotas-Coatan strip. The attack is being linked to an armed confrontation involving the GNG. The victims are suspected to be members of the GNG. 4 fatalities.",4,MX12056,Tecoanapa,2024-12-13,2025-12-13
MEX94869,2024-10-27,2024,Political violence,Violence against civilians,Attack,484,North America,Mexico,Guerrero,Tecpan de Galeana,Tecpan de Galeana,17.2226,-100.6324,El Sol de Acapulco,"Around 27 October 2024 (as reported), in Tecpan de Galeana, Guerrero, a person was killed and the body was found with signs of torture, both hands and feet tied and a rope tied to the victim's neck. 1 fatality.",1,MX12057,Técpan de Galeana,2024-12-13,2025-12-13
MEX94870,2024-10-27,2024,Political violence,Violence against civilians,Attack,484,North America,Mexico,Guerrero,Tecpan de Galeana,Tenexpa,17.1834,-100.6722,El Sol de Acapulco,"Around 27 October 2024 (as reported), in Tenexpa, Guerrero, a man was killed and his body was found with signs of torture and dressed in black near a cemetery. 1 fatality.",1,MX12057,Técpan de Galeana,2024-12-13,2025-12-13
MEX94871,2024-10-27,2024,Political violence,Violence against civilians,Attack,484,North America,Mexico,Guerrero,Tecpan de Galeana,Tenexpa,17.1834,-100.6722,El Sol de Acapulco,"Around 27 October 2024 (as reported), close to Tenexpa, Guerrero, four people were killed and their bodies were found with signs of torture and dressed in black between Tenexpa and Rodesia at a point known as Barrancones. 4 fatalities.",4,MX12057,Técpan de Galeana,2024-12-13,2025-12-13
MEX94872,2024-10-27,2024,Political violence,Violence against civilians,Attack,484,North America,Mexico,Jalisco,Tlajomulco de Zuniga,Tlajomulco de Zuniga,20.4736,-103.4431,Milenio,"Around 27 October 2024 (as reported), in Tlajomulco de Zuniga, Jalisco, a man was killed and his body was found with his hands and feet tied in fraccionamiento Villa Fontana Aqua. 1 fatality.",1,MX14097,Tlajomulco de Zúñiga,2024-12-13,2025-12-13
MEX94877,2024-10-27,2024,Political violence,Violence against civilians,Attack,484,North America,Mexico,Sinaloa,Angostura,Leopoldo Sanchez Celis,25.1254,-108.0138,Noroeste,"Around 27 October 2024 (as reported), in Leopoldo Sanchez Celis, Sinaloa, a man was killed and his body was found on the Culiacan-Eldorado highway with signs of torture. 1 fatality.",1,MX25002,Angostura,2024-12-13,2025-12-13
MEX94883,2024-10-27,2024,Political violence,Violence against civilians,Attack,484,North America,Mexico,Sinaloa,El Fuerte,San Blas,26.0776,-108.7599,Riodoce,"On 27 October 2024, in San Blas, Sinaloa, armed individuals in a vehicle opened fire and shot three people near the toll booth on their way to work in Monterrey (drive-by). All thee were killed as a result. 3 fatalities.",3,MX25010,El Fuerte,2024-12-13,2025-12-13
MEX94894,2024-10-28,2024,Political violence,Violence against civilians,Attack,484,North America,Mexico,Ciudad de Mexico,Cuauhtemoc,Ciudad de Mexico - Cuauhtemoc,19.4313,-99.1531,La Silla Rota,"On 28 October 2024, in Ciudad de Mexico - Cuauhtemoc, four people (one of them minor) 'attacked' a woman in Colonia Morelos. The specific type of attack has not been specified but the perpetrators were armed. The perpetrators were arrested when they tried to flee on Herreros street and Congreso de la Union avenue.",0,MX09015,Cuauhtémoc,2024-12-13,2025-12-13
MEX94902,2024-10-28,2024,Political violence,Violence against civilians,Attack,484,North America,Mexico,Guanajuato,Celaya,Palmita de San Gabriel,20.4983,-100.8773,Zona Franca,"Around 28 October 2024 (as reported), in Palmita de San Gabriel, Guanajuato, two men were killed and their bodies were found wrapped in plastic bags and with gunshot wounds. 2 fatalities.",2,MX11007,Celaya,2024-12-13,2025-12-13
MEX94908,2024-10-28,2024,Political violence,Battles,Armed clash,484,North America,Mexico,Guerrero,Atoyac de Alvarez,Atoyac de Alvarez,17.2127,-100.4331,El Sol de Acapulco; Mural,"On 28 October 2024, in Atoyac de Alvarez, Guerrero, army, National Guard, and federal and state police officers clashed with members of Guerrero New Generation Gang (GNG) in Colonia Miranda Fonseca. At least one police officer died. At least 1 fatality.",1,MX12011,Atoyac de Álvarez,2024-12-13,2025-12-13
MEX94917,2024-10-28,2024,Political violence,Violence against civilians,Attack,484,North America,Mexico,Michoacán,Angamacutiro,Angamacutiro de la Union,20.1491,-101.7129,Reforma,"On 28 October 2024, in Angamacutiro de la Union, Michoacan de Ocampo, the woman local Security Secretariat was shot and killed outside her house on Nicolas Bravo street, in Colonia Centro. 1 fatality.",1,MX16004,Angamacutiro,2024-12-13,2025-12-13
MEX94918,2024-10-28,2024,Political violence,Violence against civilians,Attack,484,North America,Mexico,Michoacán,Aquila,Corralitos,18.6238,-103.5051,MiMorelia,"Around 28 October 2024 (as reported), in Corralitos, Michoacan de Ocampo, a man was killed and his burnt body was found inside his burnt van. 1 fatality.",1,MX16008,Aquila,2024-12-13,2025-12-13
MEX94919,2024-10-28,2024,Political violence,Violence against civilians,Attack,484,North America,Mexico,Michoacán,Cotija,Cotija de la Paz,19.8084,-102.7041,MiMorelia; Reforma; Tabasco Hoy,"On 28 October 2024, in Cotija de la Paz, Michoacan de Ocampo, armed individuals shot and killed a former mayor and PRD candidate for mayor near a high school where he worked as a teacher on Campestre street, in Colonia Los Corrales. 1 fatality.",1,MX16019,Cotija,2024-12-13,2025-12-13
MEX94920,2024-10-28,2024,Political violence,Violence against civilians,Attack,484,North America,Mexico,Michoacán,Morelia,Morelia,19.7034,-101.192,MiMorelia,"On 28 October 2024, in Morelia, Michoacan de Ocampo, armed individuals opened fire from a vehicle (drive-by) at a man driving his car who crashed as a result in Colonia El Realito. The man died as a result. 1 fatality.",1,MX16053,Morelia,2024-12-13,2025-12-13
MEX94922,2024-10-28,2024,Political violence,Violence against civilians,Attack,484,North America,Mexico,Morelos,Jiutepec,Jiutepec,18.882,-99.1772,La Silla Rota,"Around 28 October 2024 (as reported), in Jiutepec, Morelos, a person was killed and the body was found with signs of violence and with a message next to the body in Colonia Centro. 1 fatality.",1,MX17011,Jiutepec,2024-12-13,2025-12-13
MEX94923,2024-10-28,2024,Political violence,Violence against civilians,Abduction/forced disappearance,484,North America,Mexico,Nuevo León,El Carmen,Carmen,25.9322,-100.3641,24 Horas (Mexico); El Norte; Zona Franca,"On 28 October 2024, in Carmen, Nuevo Leon, according to security camera recordings, an armed group got off at least two vehicles and abducted a man and a woman in the intersection of Rio Ramos and Arroyo San Miguel streets, in Colonia El Jaral. The victims suspectedly were delivery drivers that were delivering an order. The victims' whereabouts are unknown.",0,MX19010,El Carmen,2024-12-13,2025-12-13
MEX94924,2024-10-28,2024,Political violence,Violence against civilians,Attack,484,North America,Mexico,Nuevo León,Juarez,Benito Juarez,25.6513,-100.106,El Norte,"On 28 October 2024, in Benito Juarez, Nuevo Leon, according to witnesses, two armed individuals entered a home and opened fire at two men and one woman in Colonia Praderas de San Juan. Two men died and the woman was injured. 2 fatalities, 1 injury.",2,MX19031,Juárez,2024-12-13,2025-12-13
MEX94926,2024-10-28,2024,Political violence,Violence against civilians,Attack,484,North America,Mexico,Puebla,Puebla,Heroica Puebla de Zaragoza,19.044,-98.1975,E-Consulta,"On 28 October 2024, in Heroica Puebla de Zaragoza, Puebla, an armed individual intercepted a street vendor close to the church San Judas to demand extortion payments. When the man refused to pay, the perpetrator shot and killed the man. 1 fatality.",1,MX21114,Puebla,2024-12-13,2025-12-13
MEX94932,2024-10-28,2024,Political violence,Battles,Armed clash,484,North America,Mexico,Sinaloa,San Ignacio,Los Brasiles,24.0391,-106.0597,24 Horas (Mexico); El Sol de Sinaloa; Milenio; Noroeste; Riodoce,"On 28 October 2024, in Los Brasiles, Sinaloa, army officers and armed individuals clashed. During the clash, the officers were also attacked from a light aircraft, although the type of attack has not been specified. Two armed individuals were killed and 14 arrested. Authorities seized 19 fireweapons. 2 fatalities.",2,MX25016,San Ignacio,2024-12-13,2025-12-13
MEX94933,2024-10-28,2024,Political violence,Violence against civilians,Attack,484,North America,Mexico,Sonora,Cajeme,Ciudad Obregon,27.4965,-109.9327,Entorno Informativo,"On 28 October 2024, in Ciudad Obregon, Sonora, armed individuals on a vehicle shot at another vehicle on Jalisco and Misiones streets, in Fraccionamiento San Javier, killing a man and injuring another (drive-by). 1 fatality.",1,MX26018,Cajeme,2024-12-13,2025-12-13
MEX94935,2024-10-28,2024,Political violence,Violence against civilians,Attack,484,North America,Mexico,Sonora,San Luis Rio Colorado,San Luis Rio Colorado,32.4798,-114.7796,24 Horas (Mexico),"On 28 October 2024, in San Luis Rio Colorado, Sonora, army officers hit an unspecified number of people, members of the same family, at their house. At least one of the victims is a journalist, and the victims are relatives of a journalist that was killed in Sonora in 2023. The officers claimed that they hit the victims due to unspecified suspicions about their vehicle.",0,MX26055,San Luis Río Colorado,2024-12-13,2025-12-13
MEX94936,2024-10-28,2024,Political violence,Battles,Armed clash,484,North America,Mexico,Tabasco,Centro,Villahermosa,17.9878,-92.9194,Tabasco Hoy,"On 28 October 2024, in Villahermosa, Tabasco, two armed individuals on a motorbike shot and injured a State Preventive Police officer around a gas station and a bank office in Colonia Guayabal (drive-by). In the previous days, a video on social media indicated that the victim suspectedly worked for an organized crime organization. 1 injured.",0,MX27004,Centro,2024-12-13,2025-12-13
MEX94945,2024-10-29,2024,Political violence,Violence against civilians,Attack,484,North America,Mexico,Colima,Manzanillo,Manzanillo,19.0532,-104.3164,El Proceso,"On 29 October 2024, in Manzanillo, Colima, armed individuals on a van shot at two off-duty army officers in the intersection of 20 de Noviembre and Benito Juarez streets, in Colonia Miramar (drive-by). One of the victims died and the other was injured. 1 fatality, 1 injured.",1,MX06007,Manzanillo,2024-12-13,2025-12-13
MEX94958,2024-10-29,2024,Political violence,Battles,Armed clash,484,North America,Mexico,México,Amanalco,San Mateo,19.2804,-100.015,La Silla Rota; Milenio,"On 29 October 2024, in San Mateo, Mexico, state security officers followed an armed man on a motorbike to a house, where members of La Familia Michoacana Cartel shot at them, initiating a clash. After the clash, the officers arrested 12 people, including two cartel leaders in the Valley of Toluca. One of them was one of the most wanted persons in the country. Officers also seized nine fireweapons, 32 magazines, 900 bullets, tactical equipment similar to that used by federal and state police forces, as well as 15 packages of marijuana. Casualties unknown.",0,MX15007,Amanalco,2024-12-13,2025-12-13
MEX94962,2024-10-29,2024,Political violence,Battles,Armed clash,484,North America,Mexico,Nuevo León,Garcia,Garcia,25.8005,-100.5855,Metro Monterrey,"On 29 October 2024, in Garcia, Nuevo Leon, a man came out of a house and shot and killed another man in Colonia Real de San Joaquin. The victim along with a 13-year-old boy intended to kill a woman who was inside the house. The perpetrator fled by car along with another man, a woman and two minors. The victim's accomplice was arrested by the police. 1 fatality.",1,MX19018,García,2024-12-13,2025-12-13
MEX94966,2024-10-29,2024,Political violence,Violence against civilians,Sexual violence,484,North America,Mexico,San Luis Potosí,San Luis Potosi,Rinconada,22.255,-100.9474,Antena San Luis,"Around 29 October 2024 (month of), in Rinconada, San Luis Potosi, a man was killed and his body was found naked, in an advanced state of decomposition, with a gunshot in the head (likely 'tiro de gracia') and dog bite wounds near Zapata street and the airport. 1 fatality.",1,MX24028,San Luis Potosí,2024-12-13,2025-12-13
MEX94977,2024-10-30,2024,Political violence,Battles,Armed clash,484,North America,Mexico,Chiapas,Tuxtla Gutierrez,Tuxtla Gutierrez,16.754,-93.1152,El Proceso; La Jornada,"On 30 October 2024, in Tuxtla Gutierrez, Chiapas, an armed individual got off a taxi, entered the offices of the Federal Commission of Electricity (CFE) on 12 Poniente and 5 streets, in Colonia El Magueyito, and shot at people. A woman municipal police officer doing security work and a CFE employee died, and another CFE employee was injured, but died a day later at the hospital. 3 fatalities.",3,MX07101,Tuxtla Gutiérrez,2024-12-13,2025-12-13
MEX94978,2024-10-30,2024,Political violence,Violence against civilians,Attack,484,North America,Mexico,Chihuahua,Cuauhtemoc,Cuauhtemoc,28.4063,-106.866,Tiempo,"Around 30 October 2024 (month of), in Cuauhtemoc, Chihuahua, a woman was killed and her body was found in an advanced state of decomposition and with 'tiro de gracia' near Ejido Favela. According to the investigations, she was killed around 16 october 2024. 1 fatality.",1,MX08017,Cuauhtémoc,2024-12-13,2025-12-13
MEX94984,2024-10-30,2024,Political violence,Battles,Armed clash,484,North America,Mexico,Ciudad de Mexico,Tlahuac,Ciudad de Mexico - Tlahuac,19.2706,-99.0048,Milenio,"Around 30 October 2024 (as reported), in Ciudad de Mexico - Tlahuac, armed individuals shot at municipal police officers that were patrolling in the intersection of Emiliano Zapata street and Zaragoza avenue, in Colonia Pueblo de San Juan Ixtayopan, initiating a clash that resulted in one armed individual injured. Two armed individuals fled on motorbikes, but were arrested between Miguel Negrete and Ejido streets, together with three other men that intervened and tried to prevent the arrest. One of the arrested is an underage boy. 1 injured.",0,MX09011,Tláhuac,2024-12-13,2025-12-13
MEX94986,2024-10-30,2024,Political violence,Violence against civilians,Attack,484,North America,Mexico,Guanajuato,Celaya,Celaya,20.5215,-100.814,Zona Franca,"Around 30 October 2024 (as reported), in Celaya, Mexico, two armed men on a motorbike shot at a man and a woman on Las Torres avenue, in Colonia La Calesa (drive-by). The man died and the woman was injured. 1 fatality, 1 injured.",1,MX11007,Celaya,2024-12-13,2025-12-13
MEX94991,2024-10-30,2024,Political violence,Violence against civilians,Attack,484,North America,Mexico,México,Tecamac,San Pablo Tecalco,19.673,-98.9583,La Silla Rota,"Around 30 October 2024 (as reported), in San Pablo Tecalco, Mexico, two men were killed and their bodies were found with the hands tied and signs of torture near the lagoon. Five other bodies were found in similar circumstances in the nearby town of Tecamac de Felipe Villanueva (coded separately). 2 fatalities.",2,MX15081,Tecámac,2024-12-13,2025-12-13
MEX94992,2024-10-30,2024,Political violence,Violence against civilians,Attack,484,North America,Mexico,México,Tecamac,Tecamac de Felipe Villanueva,19.7102,-98.9671,El Siglo de Durango,"Around 30 October 2024 (as reported), in Tecamac de Felipe Villanueva, Mexico, five people (three men and two women) were killed and their bodies were found with 'tiro de gracia' on km. 38+500 of Mexico-Pachuca highway, in a place known as 'Puerta Vieja'. A version indicates that this attack took place due to a dispute over a building. Two other bodies were found in similar circumstances in the nearby town of San Pablo Tecalco (coded separately). 5 fatalities.",5,MX15081,Tecámac,2024-12-13,2025-12-13
MEX94993,2024-10-30,2024,Political violence,Violence against civilians,Attack,484,North America,Mexico,Morelos,Xochitepec,Xochitepec,18.7808,-99.2305,Diario de Morelos,"Around 30 October 2024 (as reported), in Xochitepec, Morelos, at least one person was killed and the dismembered body remains were found inside and around plastic bags at the Third Section of Unidad Morelos. At least 1 fatality.",1,MX17028,Xochitepec,2024-12-13,2025-12-13
MEX94995,2024-10-30,2024,Political violence,Battles,Armed clash,484,North America,Mexico,Nuevo León,Hualahuises,Hualahuises,24.8846,-99.6732,El Norte,"On 30 October 2024, in Hualahuises, Nuevo Leon, there was an armed clash between armed individuals against the state and ministerial police, the National Guard and military forces. Three armed men were killed. 3 fatalities.",3,MX19029,Hualahuises,2024-12-13,2025-12-13
MEX94997,2024-10-30,2024,Political violence,Violence against civilians,Attack,484,North America,Mexico,Oaxaca,San Pedro Mixtepec -Dto. 22,Puerto Escondido,15.871,-97.0757,Quadratin Oaxaca,"On 30 October 2024, in Puerto Escondido, Oaxaca, according to witnesses, armed individuals shot and killed a man in front of a car agency. 1 fatality.",1,MX20318,San Pedro Mixtepec -Dto. 22 -,2024-12-13,2025-12-13
MEX95005,2024-10-30,2024,Political violence,Violence against civilians,Attack,484,North America,Mexico,Tabasco,Cardenas,Cardenas,17.9894,-93.3769,Tabasco Hoy,"Around 30 October 2024 (as reported), in Cardenas, Tabasco, two men were killed and their bodies were found tied up to a pole and with a message in colonia Jacinto Lopez. 2 fatalities.",2,MX27002,Cárdenas,2024-12-13,2025-12-13
MEX95006,2024-10-30,2024,Political violence,Violence against civilians,Attack,484,North America,Mexico,Tabasco,Centro,Villahermosa,17.9878,-92.9194,Tabasco Hoy,"On 30 October 2024, in Villahermosa, Tabasco, according to witnesses, armed individuals shot and injured a man in Central de Abastos, between Periferico and Antonio Reyes Zurita street. 1 injured.",0,MX27004,Centro,2024-12-13,2025-12-13
MEX95007,2024-10-30,2024,Political violence,Violence against civilians,Attack,484,North America,Mexico,Tabasco,Centro,Villahermosa,17.9878,-92.9194,Tabasco Hoy,"On 30 October 2024, in Villahermosa, Tabasco, at least two armed individuals on a motorbike shot at a vehicle on Ruiz Cortines avenue, in Fraccionamiento Bonanza (drive-by), which crashed into a tree. The driver and one of the passengers were injured by bullets, while a third passenger was injured in the collision. A version indicates that two of the victims were a lawyer and his client. 3 injured.",0,MX27004,Centro,2024-12-13,2025-12-13
MEX95017,2024-10-31,2024,Political violence,Violence against civilians,Attack,484,North America,Mexico,Chihuahua,Chihuahua,Chihuahua,28.6368,-106.0763,Tiempo,"On 31 October 2024, in Chihuahua, Chihuahua, a woman was shot and injured by armed men in a vehicle in a drive-by in Juan Escutia street. 1 injured.",0,MX08019,Chihuahua,2024-12-13,2025-12-13
MEX95024,2024-10-31,2024,Political violence,Battles,Armed clash,484,North America,Mexico,Guanajuato,Yuriria,Buenavista de la Libertad,20.2839,-101.3024,La Silla Rota; Milenio,"On 31 October 2024, in Buenavista de la Libertad, Guanajuato, during the early morning, armed individuals shot at ministerial and municipal police officers who were guarding a crime scene. Two police officers were injured. Another version, is that a police commander was also injured, however, after the authorities declared that he was injured during another event near by in an attempt to robbery.",0,MX11046,Yuriria,2024-12-13,2025-12-13
MEX95036,2024-10-31,2024,Political violence,Battles,Armed clash,484,North America,Mexico,Nuevo León,Garcia,Garcia,25.8005,-100.5855,El Norte,"On 31 October 2024, in Garcia, Nuevo Leon, armed individuals shot a state police office and later also against the police. The police repelled the attack. There were no casualties.",0,MX19018,García,2024-12-13,2025-12-13
MEX95041,2024-10-31,2024,Political violence,Violence against civilians,Attack,484,North America,Mexico,San Luis Potosí,Ciudad del Maiz,Ciudad del Maiz,22.4023,-99.6028,La Jornada; La Prensa de Monclova; La Verdad,"On 31 October 2024, in Ciudad del Maiz, San Luis Potosi, a former mayor of Ciudad del Maiz and another two men were shot and killed by unidentified armed individuals on boulevard Miguel Barragan in colonia Buenos Aires. The former mayor was part of the PRI party. 3 fatalities.",3,MX24010,Ciudad del Maíz,2024-12-13,2025-12-13
MEX95042,2024-10-31,2024,Political violence,Violence against civilians,Attack,484,North America,Mexico,Tamaulipas,Reynosa,Reynosa,26.0924,-98.2781,Hoy Tamaulipas,"Around 31 October 2024 (as reported), in Reynosa, Tamaulipas, a man was killed and his body was found wrapped in a blanket and black plastic bags near the Las Anacuas Gap. 1 fatality.",1,MX28032,Reynosa,2024-12-13,2025-12-13
MEX95047,2024-10-31,2024,Political violence,Violence against civilians,Abduction/forced disappearance,484,North America,Mexico,Zacatecas,Fresnillo,Fresnillo,23.1749,-102.8682,Milenio; Pagina 24 Zacatecas; Riodoce,"On 31 October 2024, in Fresnillo, Zacatecas, armed individuals from a criminal group kidnapped three young students from the Universidad Autonoma de Zacatecas (UAZ). A day later, the victims were found alive.",0,MX32010,Fresnillo,2024-12-13,2025-12-13
