event_id_cnty,event_date,year,disorder_type,event_type,sub_event_type,iso,region,country,admin1,admin2,location,latitude,longitude,source,notes,fatalities,adm2_code,adm2_name,data_as_of,run_date
MEX94135,2024-10-18,2024,Political violence,Violence against civilians,Abduction/forced disappearance,484,North America,Mexico,Baja California,Tijuana,Tijuana,32.5325,-117.019,AFN - Tijuana,"Around 18 October 2024 (as reported), in Tijuana, Baja California, four men abducted an American man. National Guard and army officers arrested the perpetrators including a person of American origin, in a house in Colonia Obrera, where they also seized three fireweapons and drugs. It is not known whether the victim was located and released.",0,MX02004,Tijuana,2024-12-13,2025-12-13
MEX94139,2024-10-16,2024,Political violence,Violence against civilians,Abduction/forced disappearance,484,North America,Mexico,Tamaulipas,Reynosa,Reynosa,26.0924,-98.2781,Hoy Tamaulipas,"On 16 October 2024, in Reynosa, Tamaulipas, at least three armed men kidnapped a man. In response, police located the vehicle and arrested the three men.",0,MX28032,Reynosa,2024-12-13,2025-12-13
MEX94143,2024-10-17,2024,Political violence,Battles,Armed clash,484,North America,Mexico,Sinaloa,Culiacan,El Guasimal,24.9188,-107.292,Riodoce,"Around 17 October 2024 (as reported), in El Guasimal, Sinaloa, army and National Guard officers clashed with armed individuals. Six armed individuals died. Authorities seized 22 fireweapons, two grenades, and 12 vehicles. This event is likely part of the war between 'Los Chapitos' and 'Los Mayitos' factions of the Sinaloa Cartel. 6 fatalities.",6,MX25006,Culiacán,2024-12-13,2025-12-13
MEX94149,2024-10-16,2024,Political violence,Battles,Armed clash,484,North America,Mexico,Sonora,Benito Juarez,Villa Juarez,27.1283,-109.837,Entorno Informativo,"On 16 October 2024, in Villa Juarez, Sonora, a man threatened passersby with a machete and attempted to attack municipal police officers who arrived at the place. The officers shot and killed him. 1 fatality.",1,MX26071,Benito Juárez,2024-12-13,2025-12-13
MEX94151,2024-10-18,2024,Political violence,Battles,Armed clash,484,North America,Mexico,Nayarit,Huajicori,Huajicori,22.6396,-105.3315,Riodoce,"Around 18 October 2024 (as reported), in the village of San Juan (coded to Huajicori), Nayarit, National Guard, army and state police officers clashed with armed individuals that shot at the officers when they approached the scene. The officers seized a fireweapon and six explosive devices. Casualties unknown.",0,MX18005,Huajicori,2024-12-13,2025-12-13
MEX94152,2024-10-17,2024,Political violence,Battles,Armed clash,484,North America,Mexico,Zacatecas,Zacatecas,Zacatecas,22.7761,-102.5718,El Norte; El Universal (Mexico),"On 17 October 2024, in Zacatecas, Zacatecas, state police, army and National Guard officers clashed with three members of the Cartel del Noreste (CDN) in Colonia Las Americas. The three individuals were arrested. One of them suspectedly is the cartel's local leader. The officers seized three fireweapons and four explosive devices. There were no casualties.",0,MX32056,Zacatecas,2024-12-13,2025-12-13
MEX94156,2024-10-14,2024,Political violence,Battles,Armed clash,484,North America,Mexico,Puebla,Amozoc,Amozoc de Mota,19.0446,-98.0449,Milenio,"On 14 October 2024, in Amozoc de Mota, Puebla, five men attempted to abduct two officers of the General Attorney's office in La Calera. One of them got to escape and sought help, while the other was hit by the five perpetrators and local residents who joined them. Police officers arrived at the place and arrested one of the perpetrators. It is unknown whether the second victim was released.",0,MX21015,Amozoc,2024-12-13,2025-12-13
MEX94159,2024-10-14,2024,Political violence,Battles,Armed clash,484,North America,Mexico,Michoacán,Buenavista,La Ruana,19.1623,-102.7074,La Jornada,"On 14 October 2024, in La Ruana, Michoacan de Ocampo, armed individuals opened fire at state police officers, the National Guard and the military who repelled the aggression while on patrol. One Colombian man was arrested and officers located a camp with weapons, magazines, live cartridges and other equipment. Several armed men escaped the scene. There were no injuries.",0,MX16012,Buenavista,2024-12-13,2025-12-13
MEX94163,2024-10-15,2024,Political violence,Battles,Armed clash,484,North America,Mexico,San Luis Potosí,San Vicente Tancuayalab,San Vicente Tancuayalab,21.7179,-98.5875,La Jornada,"On 15 October 2024, in San Vicente Tancuayalab, San Luis Potosi, armed individuals opened fire at elements of the state police who repelled the aggression while they were on patrol. Four armed individuals were killed as a result and weapons, tactical equipment and vehicles were seized. 4 fatalities.",4,MX24034,San Vicente Tancuayalab,2024-12-13,2025-12-13
MEX94166,2024-10-16,2024,Political violence,Battles,Armed clash,484,North America,Mexico,Baja California,Tecate,Tecate,32.5727,-116.6266,Zeta Tijuana,"On 16 October 2024, in Tecate, Baja California, armed individuals on vehicles clashed along Defensores boulevard and until the road exiting towards Mexicali. Five people were injured by gunfire, although it is unknown whether they were involved in the clash. Two army officers resulted injured when their vehicle crashed while being mobilized to respond to the clash. The shooting caused damages in houses and establishments.",0,MX02003,Tecate,2024-12-13,2025-12-13
MEX94167,2024-10-18,2024,Political violence,Battles,Armed clash,484,North America,Mexico,Ciudad de Mexico,Gustavo A. Madero,Ciudad de Mexico - Gustavo A. Madero,19.4829,-99.1135,24 Horas (Mexico),"Around 18 October 2024 (as reported), in Ciudad de Mexico - Gustavo A. Madero, armed individuals on motorbikes clashed on 309 and 310 streets, in Colonia Nueva Atzacoalco, and fled when police officers approached the place. Two armed individuals, one of them injured, were later arrested when they arrived at a hospital. Another man was collaterally injured by a stray bullet.",0,MX09005,Gustavo A. Madero,2024-12-13,2025-12-13
MEX94168,2024-10-17,2024,Political violence,Battles,Armed clash,484,North America,Mexico,Sinaloa,Concordia,Concordia,23.2876,-106.0686,Riodoce,"On 17 October 2024, around Concordia, Sinaloa, armed groups clashed. Casualties unknown.",0,MX25004,Concordia,2024-12-13,2025-12-13
MEX94169,2024-10-18,2024,Political violence,Battles,Armed clash,484,North America,Mexico,Sinaloa,Concordia,Concordia,23.2876,-106.0686,Riodoce,"On 18 October 2024, around Concordia, Sinaloa, armed groups clashed. Casualties unknown.",0,MX25004,Concordia,2024-12-13,2025-12-13
MEX94179,2024-10-17,2024,Political violence,Battles,Armed clash,484,North America,Mexico,Sinaloa,Culiacan,Colonia Emancipacion (El Coronel),24.2702,-107.2051,Riodoce,"On 17 October 2024, in Colonia Emancipacion (El Coronel), Sinaloa, armed groups clashed. This event is likely part of the war between 'Los Chapitos' and 'Los Mayitos' factions of the Sinaloa Cartel. Casualties unknown.",0,MX25006,Culiacán,2024-12-13,2025-12-13
MEX94181,2024-10-17,2024,Political violence,Battles,Armed clash,484,North America,Mexico,Sinaloa,Culiacan,Guadalupe Victoria (El Atoron),24.2986,-107.2704,24 Horas (Mexico),"On 17 October 2024, in Guadalupe Victoria (El Atoron), Sinaloa, armed groups clashed. This event is likely part of the war between 'Los Chapitos' and 'Los Mayitos' factions of the Sinaloa Cartel. Casualties unknown.",0,MX25006,Culiacán,2024-12-13,2025-12-13
MEX94183,2024-10-18,2024,Political violence,Battles,Armed clash,484,North America,Mexico,Sinaloa,El Fuerte,Santa Lucia,26.2826,-108.7695,Riodoce,"On 18 October 2024, in Santa Lucia, Sinaloa, armed groups clashed. This event is likely part of the war between 'Los Chapitos' and 'Los Mayitos' factions of the Sinaloa Cartel. Casualties unknown.",0,MX25010,El Fuerte,2024-12-13,2025-12-13
MEX94184,2024-10-18,2024,Political violence,Battles,Armed clash,484,North America,Mexico,Guerrero,Cuajinicuilapa,Cuajinicuilapa,16.472,-98.4167,El Sol de Acapulco,"On 18 October 2024, in Cuajinicuilapa, Guerrero, rival gangs clashed in Colonia Los Lirios and Punta Maldonado. Casualties unknown.",0,MX12023,Cuajinicuilapa,2024-12-13,2025-12-13
MEX94187,2024-10-17,2024,Political violence,Battles,Armed clash,484,North America,Mexico,Sinaloa,Navolato,Las Puentes,24.5318,-107.541,Riodoce,"On 17 October 2024, in Las Puentes, Sinaloa, armed groups clashed. Police officers arrived to the place and found 'several' injured and dead people, an unspecified number of people tied up and three vehicles with bullet impacts. This event is likely part of the war between 'Los Chapitos' and 'Los Mayitos' factions of the Sinaloa Cartel. Unspecified number of fatalities coded as 3.",3,MX25018,Navolato,2024-12-13,2025-12-13
MEX94196,2024-10-14,2024,Political violence,Violence against civilians,Attack,484,North America,Mexico,Baja California,Tijuana,Tijuana,32.5325,-117.019,AFN - Tijuana; El Norte; La Jornada,"On 14 October 2024, in Tijuana, Baja California, unknown armed individuals shot and killed the deputy commander of the State Investigation Agency of the Attorney General of Baja California as he was leaving his home in Colonia Loma Bonita. A message was found next to the victim's body. 1 fatality.",1,MX02004,Tijuana,2024-12-13,2025-12-13
MEX94197,2024-10-17,2024,Political violence,Violence against civilians,Attack,484,North America,Mexico,Veracruz de Ignacio de la Llave,Playa Vicente,La Union Juan Enriquez,17.8681,-95.7439,La Jornada; La Silla Rota,"On 17 October 2024, in La Union Juan Enriquez, Veracruz de Ignacio de la Llave, armed individuals on motorbikes entered ranch 'San Sebastian', on the path heading to La Petronila, and shot and killed its owner. The victim was a municipal police officer and veterinarian. 1 fatality.",1,MX30130,Playa Vicente,2024-12-13,2025-12-13
MEX94198,2024-10-16,2024,Political violence,Violence against civilians,Attack,484,North America,Mexico,Michoacán,Jacona,Jacona de Plancarte,19.9563,-102.306,La Voz de Michoacan,"On 16 October 2024, in Jacona de Plancarte, Michoacan de Ocampo, at least four armed men shot at a woman outside her home in Colonia Buenos Aires and then fled the scene. 1 injury.",0,MX16043,Jacona,2024-12-13,2025-12-13
MEX94199,2024-10-14,2024,Political violence,Violence against civilians,Attack,484,North America,Mexico,Michoacán,Ario,Ario de Rosales,19.2078,-101.7094,MiMorelia,"Around 14 October 2024 (as reported), in Ario de Rosales, Michoacan de Ocampo, an elderly woman was killed by unknown assailants and her body was found wrapped in bags in Doctor Miguel Silva. 1 fatality.",1,MX16009,Ario,2024-12-13,2025-12-13
MEX94200,2024-10-14,2024,Political violence,Violence against civilians,Attack,484,North America,Mexico,Morelos,Cuernavaca,Cuernavaca,18.9218,-99.2349,Diario de Morelos,"Around 14 October 2024 (as reported), in Cuernavaca, Morelos, an elderly woman was killed by unknown armed assailants and her body was found wrapped in a blanket and with a gunshot to her head in Colonia San Jeronimo. 1 fatality.",1,MX17007,Cuernavaca,2024-12-13,2025-12-13
MEX94202,2024-10-14,2024,Political violence,Violence against civilians,Attack,484,North America,Mexico,Quintana Roo,Solidaridad,Playa del Carmen,20.6281,-87.0755,La Verdad,"Around 14 October 2024 (as reported), in Playa del Carmen, Quintana Roo, a woman was killed by unknown assailants and her body was found wrapped in plastic bags inside a garbage can. 1 fatality.",1,MX23008,Solidaridad,2024-12-13,2025-12-13
MEX94208,2024-10-16,2024,Political violence,Violence against civilians,Attack,484,North America,Mexico,Chihuahua,Chihuahua,Chihuahua,28.6368,-106.0763,Tiempo,"On 16 October 2024, in Chihuahua, Chihuahua, a man opened fire at the facade of a home and then fled the scene. There were no injuries.",0,MX08019,Chihuahua,2024-12-13,2025-12-13
MEX94209,2024-10-15,2024,Political violence,Violence against civilians,Attack,484,North America,Mexico,Morelos,Cuernavaca,Cuernavaca,18.9218,-99.2349,Diario de Morelos,"On 15 October 2024, in Cuernavaca, Morelos, armed individuals on two motorcycles opened fire and shot a man traveling in a vehicle in Colonia Tres de Mayo. The man was injured as a result and one woman was hit by a stray bullet and injured. 2 injuries.",0,MX17007,Cuernavaca,2024-12-13,2025-12-13
MEX94210,2024-10-14,2024,Political violence,Violence against civilians,Attack,484,North America,Mexico,Morelos,Xochitepec,Atlacholoaya,18.7442,-99.226,Diario de Morelos,"On 14 October 2024, in Atlacholoaya, Morelos, two armed individuals attacked and shot a man when he was walking to Colonia Lazaro Cardenas. The man was leaving the penitentiary center and was a former inmate. 1 injury.",0,MX17028,Xochitepec,2024-12-13,2025-12-13
MEX94211,2024-10-14,2024,Political violence,Violence against civilians,Attack,484,North America,Mexico,Morelos,Puente de Ixtla,Xoxocotla,18.6846,-99.2458,Diario de Morelos,"On 14 October 2024, in Xoxocotla, Morelos, two armed individuals opened fire at three men drinking alcohol and then fled the scene on a motorcycle. All three men were injured as a result. 3 injuries.",0,MX17017,Puente de Ixtla,2024-12-13,2025-12-13
MEX94215,2024-10-17,2024,Political violence,Violence against civilians,Attack,484,North America,Mexico,Quintana Roo,Benito Juarez,Cancun,21.1614,-86.8248,El Norte,"Around 17 October 2024 (as reported), in Cancun, Quintana Roo, two armed individuals shot and injured two underage people in Villas Otoch, behind the Public Safety academy. The perpetrators later sought refugee inside a store in Supermanzana 218, where army and police officers arrested them.",0,MX23005,Benito Juárez,2024-12-13,2025-12-13
MEX94228,2024-10-16,2024,Political violence,Violence against civilians,Attack,484,North America,Mexico,Veracruz de Ignacio de la Llave,Paso del Macho,Paso del Macho,18.971,-96.7242,Imagen del Golfo,"On 16 October 2024, in Paso del Macho, Veracruz de Ignacio de la Llave, two armed individuals shot and killed a man in Colonia Reforma and then escaped the scene. 1 fatality.",1,MX30125,Paso del Macho,2024-12-13,2025-12-13
MEX94230,2024-10-14,2024,Political violence,Violence against civilians,Attack,484,North America,Mexico,Morelos,Cuernavaca,Cuernavaca,18.9218,-99.2349,Diario de Morelos,"On 14 October 2024, in Cuernavaca, Morelos, two armed men shot a man three times while he was eating tacos in Colonia Lagunilla. Two other individuals shot him in the head. The man died as a result. 1 fatality.",1,MX17007,Cuernavaca,2024-12-13,2025-12-13
MEX94234,2024-10-14,2024,Political violence,Violence against civilians,Attack,484,North America,Mexico,Jalisco,San Pedro Tlaquepaque,Tlaquepaque,20.6386,-103.3072,Milenio,"On 14 October 2024, in Tlaquepaque, Jalisco, a person was killed and the body was found wrapped in plastic in Colonia La Gigantera. The person had been dead for around 4 hours. 1 fatality.",1,MX14098,San Pedro Tlaquepaque,2024-12-13,2025-12-13
MEX94235,2024-10-14,2024,Political violence,Violence against civilians,Attack,484,North America,Mexico,Ciudad de Mexico,Venustiano Carranza,Ciudad de Mexico - Venustiano Carranza,19.4193,-99.1137,El Norte,"Around 14 October 2024 (as reported), in Ciudad de Mexico - Venustiano Carranza, a person was killed and the body was found with signs of torture inside a car. 1 fatality.",1,MX09017,Venustiano Carranza,2024-12-13,2025-12-13
MEX94236,2024-10-14,2024,Political violence,Violence against civilians,Attack,484,North America,Mexico,Chiapas,Villa Corzo,Villa Corzo,16.1851,-93.2688,Milenio,"Around 14 October 2024 (as reported), in Villa Corzo, Chiapas, a man was killed and his body was found wrapped in plastic bags at the height of the ranch San Julian. 1 fatality.",1,MX07107,Villa Corzo,2024-12-13,2025-12-13
MEX94237,2024-10-16,2024,Political violence,Violence against civilians,Attack,484,North America,Mexico,Chiapas,Tuxtla Gutierrez,Tuxtla Gutierrez,16.754,-93.1152,Milenio,"Around 16 October 2024 (as reported), in Tuxtla Gutierrez, Chiapas, a man was killed and his body was found with signs of torture and bullet wounds in fraccionamiento Real del Bosque. The man was abandoned by a group of armed men. 1 fatality.",1,MX07101,Tuxtla Gutiérrez,2024-12-13,2025-12-13
MEX94238,2024-10-17,2024,Political violence,Violence against civilians,Attack,484,North America,Mexico,Tabasco,Huimanguillo,Chontalpa,17.6661,-93.4811,Tabasco Hoy,"Around 17 October 2024 (as reported), in Chontalpa, Tabasco, a man was killed and his body was found together with a cardboard with a written threatening message on the side of Chontalpa-Cardenas road connecting C16 and C9 villages. The victim was suspectedly responsible of robberies in the area, and the message was addressed to people linked to extorsions, abductions, who were given 24 hours to leave the area or there would be more executions. 1 fatality.",1,MX27008,Huimanguillo,2024-12-13,2025-12-13
MEX94240,2024-10-17,2024,Political violence,Violence against civilians,Attack,484,North America,Mexico,Baja California,Tijuana,Tijuana,32.5325,-117.019,AFN - Tijuana,"On 17 October 2024, in Tijuana, Baja California, two armed individuals shot at three men on Soledad Orozco street, in Colonia Mineral de Santa Fe, killing one and injured the two others. The perpetrators fled towards Silverio Aleman street. 1 fatality.",1,MX02004,Tijuana,2024-12-13,2025-12-13
MEX94242,2024-10-18,2024,Political violence,Violence against civilians,Attack,484,North America,Mexico,Tlaxcala,San Pablo del Monte,Ciudad de San Pablo del Monte,19.1197,-98.1704,E-Consulta,"Around 18 October 2024 (as reported), in Ciudad de San Pablo del Monte, Tlaxcala, a man was killed and his body was found with a noose around the neck and inside plastic bags in the intersection of 5 de Marzo street and Ayuntamiento avenue. 1 fatality.",1,MX29025,San Pablo del Monte,2024-12-13,2025-12-13
MEX94243,2024-10-18,2024,Political violence,Violence against civilians,Attack,484,North America,Mexico,Guanajuato,Irapuato,Irapuato,20.6728,-101.3481,La Silla Rota,"Around 18 October 2024 (as reported), in Irapuato, Guanajuato, a person was killed and the body was found inside bags. 1 fatality.",1,MX11017,Irapuato,2024-12-13,2025-12-13
MEX94244,2024-10-15,2024,Political violence,Violence against civilians,Attack,484,North America,Mexico,Nuevo León,Garcia,Garcia,25.8005,-100.5855,El Norte,"On 15 October 2024, in Garcia, Nuevo Leon, according to witnesses, armed individuals chased a man across Colonia Privada de las Villas, and shot and killed him in the intersection of Villa Granada and Villa Plasencia streets, in front of Ninos Saturnino Herran kindergarten. 1 fatality.",1,MX19018,García,2024-12-13,2025-12-13
MEX94249,2024-10-15,2024,Political violence,Violence against civilians,Attack,484,North America,Mexico,Baja California,Tijuana,Tijuana,32.5325,-117.019,Zeta Tijuana,"Around 15 October 2024 (as reported), in Tijuana, Baja California, two people were killed and their bodies were found wrapped in a tarp inside the trunk of a car close to Colonia Lazaro Cardenas. 2 fatalities.",2,MX02004,Tijuana,2024-12-13,2025-12-13
MEX94257,2024-10-15,2024,Political violence,Violence against civilians,Attack,484,North America,Mexico,Sinaloa,Culiacan,Laguna de Canachi,24.1361,-107.0999,El Sol de Sinaloa; La Jornada,"Around 15 October 2024 (as reported), in Laguna de Canachi, Sinaloa, five people were killed and their bodies were found with signs of torture and gunshot wounds and semi-naked. 5 fatalities.",5,MX25006,Culiacán,2024-12-13,2025-12-13
MEX94258,2024-10-15,2024,Political violence,Violence against civilians,Attack,484,North America,Mexico,Chiapas,Huitiupan,Huitiupan,17.1728,-92.684,La Jornada,"Around 15 October 2024 (as reported), in the municipality of Huitiupan, Chiapas, the former mayor of San Andres Duraznal was killed and his body was found in the ejido San Francisco la Fronter. 1 fatality.",1,MX07039,Huitiupán,2024-12-13,2025-12-13
MEX94259,2024-10-18,2024,Political violence,Violence against civilians,Attack,484,North America,Mexico,Colima,Minatitlan,Minatitlan,19.386,-104.0493,Colima Noticias,"Around 18 October 2024 (as reported), near Minatitlan, Colima, a man was killed and his body was found with 'tiro de gracia' and a threatening message written on a cardboard inside a vehicle on Manzanillo-Minatitlan road. The victim was a former local congressman and former municipal president of Minatitlan. 1 fatality.",1,MX06008,Minatitlán,2024-12-13,2025-12-13
MEX94261,2024-10-15,2024,Political violence,Violence against civilians,Attack,484,North America,Mexico,Oaxaca,San Pedro Pochutla,San Pedro Pochutla,15.7463,-96.4652,Imagen del Golfo; La Silla Rota,"On 15 October 2024, in San Pedro Pochutla, Oaxaca, an armed individual attacked and stabbed the mayor of Candelaria Loxicha outside his home in the neighborhood El Calvario who died as a result. 1 fatality.",1,MX20324,San Pedro Pochutla,2024-12-13,2025-12-13
MEX94263,2024-10-18,2024,Political violence,Violence against civilians,Attack,484,North America,Mexico,Baja California,Tijuana,Tijuana,32.5325,-117.019,AFN - Tijuana; Zeta Tijuana,"Around 18 October 2024 (as reported), in Tijuana, Baja California, a man was killed and his dismembered body was found inside a plastic container together with a threatening message written on a cardboard in a car on Ninos Heroes street, between Segunda and Tercera streets, in front of Technology Square, in Colonia Centro. The victim was the owner of 'Sodoma' bar and member of the LGBTQ+ community. Police officers arrested the suspected perpetrator on 18 October 2024 in the intersection of Mallorca street and 20 de Noviembre, in Colonia Hidalgo. 1 fatality.",1,MX02004,Tijuana,2024-12-13,2025-12-13
MEX94264,2024-10-18,2024,Political violence,Violence against civilians,Attack,484,North America,Mexico,Morelos,Xochitepec,Xochitepec,18.7808,-99.2305,La Silla Rota,"On 18 October 2024, in Xochitepec, Morelos, according to witnesses, two armed individuals on a motorbike attempted to rob a man that was driving a motorbike, and shot and killed him when the victim attempted to flee (drive-by). The victim was a Programming student at the Center of Industrial Technology and Services Studies (CETis) 43. 1 fatality.",1,MX17028,Xochitepec,2024-12-13,2025-12-13
MEX94279,2024-10-14,2024,Political violence,Violence against civilians,Attack,484,North America,Mexico,Oaxaca,Heroica Ciudad de Juchitan de Zaragoza,Juchitan de Zaragoza,16.4333,-95.0216,Quadratin Oaxaca,"Around 14 October 2024 (as reported), in Juchitan de Zaragoza, Oaxaca, a person was killed and the body was found with signs of torture and the 'tiro de gracia' on the Tehuantepec-Juchitan de Zaragoza highway. 1 fatality.",1,MX20043,Heroica Ciudad de Juchitán de Zaragoza,2024-12-13,2025-12-13
MEX94281,2024-10-15,2024,Political violence,Violence against civilians,Attack,484,North America,Mexico,Chihuahua,Chihuahua,Chihuahua,28.6368,-106.0763,Tiempo,"On 15 October 2024, in Chihuahua, Chihuahua, unknown armed individuals intercepted a man in Valles del Sur, shot him nine times and then fled the scene (drive-by). The man died as a result. 1 fatality.",1,MX08019,Chihuahua,2024-12-13,2025-12-13
MEX94286,2024-10-14,2024,Political violence,Violence against civilians,Attack,484,North America,Mexico,Sonora,Cajeme,Providencia,27.511,-109.9869,Entorno Informativo,"On 14 October 2024, in Providencia, Sonora, armed individuals in a vehicle intercepted a man walking on the street, shot him and then fled the scene (drive-by). The man died as a result. 1 fatality.",1,MX26018,Cajeme,2024-12-13,2025-12-13
MEX94288,2024-10-15,2024,Political violence,Violence against civilians,Attack,484,North America,Mexico,Tabasco,Huimanguillo,El Chinal,17.9288,-93.3881,Tabasco Hoy,"On 15 October 2024, close to El Chinal, Tabasco, a man was shot and killed inside a home in Colonia Benito Juarez and a message was left next to the body threatening extortionists, kidnappers and people dedicated to the sale of drugs to leave the area. 1 fatality.",1,MX27008,Huimanguillo,2024-12-13,2025-12-13
MEX94289,2024-10-14,2024,Political violence,Violence against civilians,Attack,484,North America,Mexico,Jalisco,San Pedro Tlaquepaque,Tlaquepaque,20.6386,-103.3072,Milenio,"Around 14 October 2024 (as reported), in Tlaquepaque, Jalisco, a person was killed and the decapitated head was found after it was thrown from a motorcycle, according to witnesses, in Colonia Buenos Aires. 1 fatality.",1,MX14098,San Pedro Tlaquepaque,2024-12-13,2025-12-13
MEX94291,2024-10-17,2024,Political violence,Violence against civilians,Attack,484,North America,Mexico,Chihuahua,Chihuahua,Chihuahua,28.6368,-106.0763,Tiempo,"On 17 October 2024, in Chihuahua, Chihuahua, armed individuals on a vehicle shot and killed a man on Praderas Patagonicas and Praderas de Australia streets, in Colonia Urbi Villas del Prado (drive-by). Police officer later found the vehicle used by the perpetrators on Praderas de Nebraska and Praderas de Australia streets, in Colonia Praderas del Sur. 1 fatality.",1,MX08019,Chihuahua,2024-12-13,2025-12-13
MEX94292,2024-10-14,2024,Political violence,Violence against civilians,Attack,484,North America,Mexico,Morelos,Yautepec,Cocoyoc,18.8815,-98.9803,Diario de Morelos,"On 14 October 2024, in Cocoyoc, Morelos, according to witnesses, two armed individuals on a motorbike shot and killed a man on Emiliano Zapata avenue (drive-by). The perpetrators fled towards Cuautla-Cuernavaca road. 1 fatality.",1,MX17029,Yautepec,2024-12-13,2025-12-13
MEX94293,2024-10-17,2024,Political violence,Violence against civilians,Attack,484,North America,Mexico,Baja California,Tijuana,Tijuana,32.5325,-117.019,AFN - Tijuana,"Around 17 October 2024 (as reported), in Tijuana, Baja California, a person was killed and the burnt body was found on a path near Corredor 2000 and Fraccionamiento Natura. 1 fatality.",1,MX02004,Tijuana,2024-12-13,2025-12-13
