event_id_cnty,event_date,year,disorder_type,event_type,sub_event_type,iso,region,country,admin1,admin2,location,latitude,longitude,source,notes,fatalities,adm2_code,adm2_name,data_as_of,run_date
MEX95431,2024-11-12,2024,Political violence,Violence against civilians,Attack,484,North America,Mexico,Colima,Villa de Alvarez,Ciudad de Villa de Alvarez,19.2648,-103.7368,Colima Noticias,"On 12 November 2024, in Ciudad de Villa de Alvarez, Colima, armed individuals on a motorcycle shot and killed a man in a drive-by shooting in colonia Villas Bugambilias. 1 fatality.",1,MX06010,Villa de Álvarez,2024-12-13,2025-12-13
MEX95627,2024-11-07,2024,Political violence,Battles,Armed clash,484,North America,Mexico,Sinaloa,Culiacan,Las Milpas,24.5426,-107.1993,24 Horas (Mexico); El Sol de Sinaloa; Noroeste,"On 7 November 2024, in Las Milpas, Sinaloa, military officers and armed individuals clashed. The officers arrested ten people (eight men and two women), including a leader of Los Mayitos faction of the Sinaloa Cartel. The officers also seized nine fireweapons and three vehicles. Casualties unknown.",0,MX25006,Culiacán,2024-12-13,2025-12-13
MEX94638,2024-10-21,2024,Political violence,Battles,Armed clash,484,North America,Mexico,Sinaloa,Cosala,Cosala,24.4127,-106.6913,Riodoce,"On 21 October 2024, in Cosala, Sinaloa, there was an armed clash between armed individuals (likely affiliated with the Sinaloa Cartel) and the military forces, the National Guard and the state police. This event is related to similar clashes involving factions of the Sinaloa Cartel recorded in other locations of this state (coded separately). There were no casualties.",0,MX25005,Cosalá,2024-12-13,2025-12-13
MEX94738,2024-10-19,2024,Political violence,Violence against civilians,Attack,484,North America,Mexico,Guerrero,Juchitan,Juchitan,16.6271,-98.6367,Quadratin Oaxaca,"Around 19 October 2024 (as reported), in Juchitan, Guerrero, a person was killed and the body was found with a gunshot wound in the head (likely tiro de gracia) and the hands tied. 1 fatality.",1,MX12080,Juchitán,2024-12-13,2025-12-13
MEX95096,2024-11-02,2024,Political violence,Violence against civilians,Attack,484,North America,Mexico,Morelos,Jiutepec,Tejalpa,18.9023,-99.1682,Diario de Morelos,"On 2 November 2024, in Tejalpa, Morelos, according to witnesses, armed men shot and killed a man in a gaming shop. According to local sources, the victim was the owner of the shop. 1 fatality.",1,MX17011,Jiutepec,2024-12-13,2025-12-13
MEX95591,2024-11-13,2024,Political violence,Violence against civilians,Abduction/forced disappearance,484,North America,Mexico,Sinaloa,Ahome,Los Mochis,25.7834,-108.9943,Milenio,"On 13 November 2024, in Los Mochis, Sinaloa, three armed individuals kidnapped a 14-year-old teenager when he left his home in fraccionamiento Los Laureles. The minor was released on 15 November.",0,MX25001,Ahome,2024-12-13,2025-12-13
MEX96754,2024-10-27,2024,Political violence,Violence against civilians,Attack,484,North America,Mexico,Michoacán,Tarimbaro,Tarimbaro,19.7957,-101.1764,La Voz de Michoacan,"On 27 October 2024, in Tarimbaro, Michoacan de Ocampo, a man on a motorcycle shot at a man who was driving on La Palma avenue, in Fraccionamiento San Jose de la Palma (drive-by). The man was with his two underage daughters, one of whom was killed. The man and the other girl remained uninjured. A suspect was arrested on 16 November 2024, and another one is wanted. 1 fatality.",1,MX16088,Tarímbaro,2024-12-13,2025-12-13
MEX103670,2024-10-25,2024,Political violence,Violence against civilians,Abduction/forced disappearance,484,North America,Mexico,Guanajuato,Silao de la Victoria,Silao de la Victoria,20.9445,-101.4262,Zona Franca,"On 25 October 2024, in Silao de la Victoria, Guanajuato, a woman and two men abducted a person in the intersection of 16 de Septiembre and Vicente Guerrero streets. The woman was arrested. The victim's whereabouts are unknown.",0,MX11037,Silao de la Victoria,2024-12-13,2025-12-13
MEX95094,2024-11-02,2024,Political violence,Violence against civilians,Attack,484,North America,Mexico,Michoacán,Morelia,Jesus del Monte,19.6514,-101.1517,Riodoce,"On 2 November 2024, in Jesus del Monte, Michoacan, according to witnesses, three armed men shot and killed a woman and injured other three women in a pantheon. 1 fatality, 3 injured.",1,MX16053,Morelia,2024-12-13,2025-12-13
MEX94266,2024-10-17,2024,Political violence,Violence against civilians,Attack,484,North America,Mexico,Ciudad de Mexico,Cuauhtemoc,Ciudad de Mexico - Cuauhtemoc,19.4313,-99.1531,24 Horas (Mexico); AFN - Tijuana; Diario de Morelos; El Blog del Narco; El Norte; El Proceso; El Universal (Mexico); La Jornada; La Silla Rota; La Verdad; La Voz de Michoacan; Milenio; Tabasco Hoy,"On 17 October 2024, in Ciudad de Mexico - Cuauhtemoc, two armed individuals on a motorbike shot and killed a woman lawyer who was driving a van on Viaducto Miguel Aleman, near Parque Delta shopping mall and the intersection with Cuauhtemoc avenue, in Colonia Roma (drive-by). A version indicates that the perpetrators were following the victim since she left a bank. Police officers later found the motorbike used by the perpetrators in Colonia Obrera. The victim had previously been threatened by an officer of the Mexico City Attorney General's Office due to personal disputes. The suspected accomplices of the perpetrators, a man and two women, were arrested in Colonia Doctores, Cuauhtemoc, on 25 October 2024. One of the perpetrators was arrested in Colonia Obrera, Cuauhtemoc, on 13 December 2024. Another perpetrator (a man) and a woman who suspectedly planned the attack were arrested on 13 May 2025. 1 fatality.",1,MX09015,Cuauhtémoc,2024-12-13,2025-12-13
MEX94170,2024-10-15,2024,Political violence,Battles,Armed clash,484,North America,Mexico,Sinaloa,Elota,El Chirimole,24.2066,-106.645,El Sol de Sinaloa,"On 15 October 2024, in El Chirimole, Sinaloa, armed confrontations took place resulting in an unknown number of fatalities. Unspecified fatalities coded to 3.",3,MX25008,Elota,2024-12-13,2025-12-13
MEX94251,2024-10-18,2024,Political violence,Violence against civilians,Attack,484,North America,Mexico,Sinaloa,Navolato,San Pedro,24.7734,-107.5504,Riodoce,"Around 18 October 2024 (as reported), in San Pedro, Sinaloa, two people were killed and their bodies were found with signs of torture and wrapped in plastic on the path that connects Las Cribas and the landfill, 300 meters north of the Obelisk to the Battle of San Pedro. 2 fatalities.",2,MX25018,Navolato,2024-12-13,2025-12-13
MEX94311,2024-10-18,2024,Political violence,Violence against civilians,Attack,484,North America,Mexico,Sonora,Altar,Altar,30.717,-111.838,AP; El Norte; Infobae; La Verdad; Tabasco Hoy; Univision,"On 18 October 2024, in Altar, Sonora, according to witnesses, armed individuals on a vehicle shot at a vehicle on Caborca-Altar road, killing an American man (drive-by). The victim was an off-duty American Marine. Two other women who were in the vehicle were not injured. One of the perpetrators, a suspected member of Los Deltas armed cell of Los Mayitos Gang, was arrested in Altar on 30 October 2024. Another perpetrator was killed during an armed clash with security forces in Altar around 30 October 2024 (coded separately). A third perpetrator was arrested in Altar on 13 February 2025. 1 fatality.",1,MX26004,Altar,2024-12-13,2025-12-13
MEX94717,2024-10-25,2024,Political violence,Battles,Armed clash,484,North America,Mexico,Sinaloa,Navolato,San Pedro,24.7734,-107.5504,El Sol de Sinaloa; Riodoce,"On 25 October 2024, in San Pedro, Sinaloa, armed men opened fire at municipal security and traffic police officers on patrol, leading to the death of two officers while two other officers were injured. 2 fatalities, 2 injuries.",2,MX25018,Navolato,2024-12-13,2025-12-13
MEX94748,2024-10-20,2024,Political violence,Violence against civilians,Attack,484,North America,Mexico,Chiapas,San Cristobal de las Casas,San Cristobal de las Casas,16.737,-92.6376,AFP; AP; Borderland Beat; Diario de Morelos; El Siglo de Durango; Imagen del Golfo; La Jornada; La Verdad; MiMorelia; Quadratin Oaxaca; SDP Noticias; Tabasco Hoy; Zeta Tijuana; Zona Franca,"On 20 October 2024, in San Cristobal de las Casas, Chiapas, according to witnesses, between two and four masked armed individuals on motorbikes shot and killed a man inside a van in the intersection of Las Peras and Franz Bloom streets, in the neighborhood of Cuxtitali (drive-by). The victim was a Tzotzil Indigenous (Mayan Indigenous group) catholic priest and human rights activist who had just officiated a mass at the church of Cuxtitali and was heading to the church of Guadalupe. The victim was known for denouncing the presence of criminal groups in Chiapas and participating in negotiations to solve conflicts between Indigenous communities and criminal groups. In 2021, the victim supported and mediated with the government for the formation of El Machete Policia Comunitaria in Pantelho. The same year, he was accused of being linked to the abduction of 21 men in Pantelho. According to some versions, the victim had been previously threatened by politicians connected to organized crime in the municipality of Simojovel, where the victim practiced as a priest. Additional versions indicate that the perpetrators of this attack could be members of Los Motonetos Gang or Los Herreras Gang. 1 fatality.",1,MX07078,San Cristóbal de las Casas,2024-12-13,2025-12-13
MEX94852,2024-10-26,2024,Political violence,Battles,Armed clash,484,North America,Mexico,Sinaloa,Navolato,San Pedro,24.7734,-107.5504,Milenio,"On 26 October 2024, in San Pedro, Sinaloa, unknown armed individuals attacked municipal police officers killing two police officers and injuring two while they were on surveillance. 2 fatalities, 2 injuries.",2,MX25018,Navolato,2024-12-13,2025-12-13
MEX94967,2024-10-29,2024,Political violence,Violence against civilians,Attack,484,North America,Mexico,Sinaloa,Culiacan,Carrizalejo,24.8104,-107.2887,El Sol de Sinaloa; Mural,"Around 29 October 2024 (as reported), near Carrizalejo, Sinaloa, two men were killed and their bodies were found with gunshot wounds, signs of torture, and covered by a canvas on a path that connects the road to Sanalona and La Grunidora village, a few meters from the bridge on Del Toro river. 2 fatalities.",2,MX25006,Culiacán,2024-12-13,2025-12-13
MEX95004,2024-10-30,2024,Political violence,Battles,Armed clash,484,North America,Mexico,Sonora,Altar,Altar,30.717,-111.838,AP; Infobae; Univision,"Around 30 October 2024 (as reported), in Altar, Sonora, two armed men on a vehicle shot at municipal police officers on Obregon street. The officers fired back and killed the two men. One of them, an Honduran citizen, was a deserter from the Presidential Honor Guard of Honduras who was also a member of Los Delta Gang (allied of Los Mayitos Gang) and was one of the perpetrators of the killing of an American citizen in Altar on 18 October 2024 (coded separately). 2 fatalities.",2,MX26004,Altar,2024-12-13,2025-12-13
MEX95009,2024-10-30,2024,Political violence,Battles,Armed clash,484,North America,Mexico,Veracruz de Ignacio de la Llave,Martinez de la Torre,Martinez de la Torre,20.0734,-97.0538,Imagen del Golfo; Milenio,"On 30 October 2024, in Martinez de la Torre, Veracruz, according to witnesses, armed individuals threw a Molotov bomb at a municipal police patrol in colonia Ejidal. There were no casualties.",0,MX30102,Martínez de la Torre,2024-12-13,2025-12-13
MEX95239,2024-11-06,2024,Political violence,Violence against civilians,Attack,484,North America,Mexico,Guerrero,Chilpancingo de los Bravo,Chilpancingo de los Bravo,17.5516,-99.5011,24 Horas (Mexico); 8 Columnas; AFN - Tijuana; AFP; AP; Diario de Morelos; E-Consulta; El Blog del Narco; El Proceso; El Siglo de Durango; El Sol de Acapulco; El Sol de Sinaloa; Entorno Informativo; La Jornada; La Prensa de Monclova; La Silla Rota; La Verdad; Milenio; Mural; Reforma; Riodoce; Sintesis; Tabasco Hoy; Xinhua; Zeta Tijuana; Zona Franca,"Around 6 November 2024 (as reported), in Chilpancingo de los Bravo, Guerrero, 11 people (two women and nine men, four of them minors) were killed and their dismembered bodies were found inside a van on Vicente Guerrero boulevard, on km. 272 of Del Sol highway, by Parador del Marques. The victims have been identified as part of the 17 vendors from Chautipan that disappeared in the villages of El Epazote (municipality of Chilapa de Alvarez) and Tlanicuilulco (municipality of Quechultenango) between 21-27 October 2024 (uncoded). On 4 November 2024, one of the minors appeared in a video on social media with the hands tied and saying that Los Jaleacos Gang had sent him to register the movements of Los Ardillos Gang. According to the military, members of Los Ardillos Gang abducted the victims and perpetrated this attack. 11 fatalities.",11,MX12029,Chilpancingo de los Bravo,2024-12-13,2025-12-13
MEX95308,2024-11-07,2024,Political violence,Violence against civilians,Attack,484,North America,Mexico,Sinaloa,Culiacan,Carrizalejo,24.8104,-107.2887,Borderland Beat; El Blog del Narco; El Proceso; El Sol de Sinaloa; La Prensa de Monclova; La Verdad; Milenio; Noroeste; Riodoce,"Around 7 November 2024 (as reported), in Carrizalejo, Sinaloa, a man was killed and his body was found with gunshot wounds, signs of torture, and wrapped in a canvas on the road to Sinaloa, in front of a pantheon. The victim was a former judicial police officer that had been in prison due to his participation in a plan to kill President Felipe Calderon, in response to security operations against the Sinaloa Cartel. 1 fatality.",1,MX25006,Culiacán,2024-12-13,2025-12-13
MEX95350,2024-11-08,2024,Political violence,Battles,Armed clash,484,North America,Mexico,Michoacán,Apatzingan,Las Bateas,18.9906,-102.4858,La Voz de Michoacan; Milenio; MiMorelia,"On 8 November 2024, in Las Bateas, Michoacan de Ocampo, members of Los Caballeros Templarios Gang and the Jalisco New Generation Cartel (CJNG) clashed. This event is related to other clashes that took place in El Alcalde, Los Tepetates, Los Charcos, and El Capire (coded separately). Casualties unknown.",0,MX16006,Apatzingán,2024-12-13,2025-12-13
MEX95351,2024-11-08,2024,Political violence,Battles,Armed clash,484,North America,Mexico,Michoacán,Apatzingan,Las Bateas,18.9906,-102.4858,La Voz de Michoacan; Milenio; MiMorelia,"On 8 November 2024, in Las Bateas, Michoacan de Ocampo, there was an armed clash between members of the CJNG and Military, National Guard, and state police officers. The police were patrolling the area following a confrontation between members of the CJNG and Los Caballeros Templarios gang (coded separately). Four members of the cartel were arrested. The officers also seized four fireweapons and tactical equipment with the letters 'F.E.M. CJNG' written on it. There were no fatalities.",0,MX16006,Apatzingán,2024-12-13,2025-12-13
MEX95585,2024-11-09,2024,Political violence,Battles,Armed clash,484,North America,Mexico,Querétaro,Queretaro,Santiago de Queretaro,20.5934,-100.39,24 Horas (Mexico); AFN - Tijuana; AFP; AP; Borderland Beat; Colima Noticias; Diario de Morelos; E-Consulta; El Norte; El Proceso; El Siglo de Durango; El Universal (Mexico); GardaWorld; La Jornada; La Silla Rota; La Verdad; La Voz de Michoacan; Milenio; Reforma; Sintesis; Tabasco Hoy; Xinhua; Zeta Tijuana,"On 9 November 2024, in Santiago de Queretaro, Queretaro, according to witnesses, four suspected members of the Santa Rosa de Lima Cartel entered Los Cantaritos bar on Circunvalacion avenue, in Colonia San Javier, and shot and killed 10 people (seven men and three women). 13 other people were injured. According to security authorities, the attack targeted one of the killed men, who was the leader of the Jalisco New Generation Cartel (CJNG) in Queretaro. He led a cell dedicated to the theft of fuel (huachicol) and was engaged in a territorial dispute with the Santa Rosa de Lima Cartel. A suspect was arrested the same day in the town of La Piedad, in the municipality of El Marques; three other suspects were arrested on 19 November 2024 in unspecified locations; two other were arrested on 21 November 2024 in the municipalities of Queretaro and Corregidora; and another was arrested in Queretaro around 22 August 2025. 10 fatalities, 13 injured.",10,MX22014,Querétaro,2024-12-13,2025-12-13
MEX95598,2024-11-11,2024,Political violence,Violence against civilians,Attack,484,North America,Mexico,Sinaloa,Culiacan,Carrizalejo,24.8104,-107.2887,El Sol de Sinaloa; Riodoce,"Around 11 November 2024 (as reported), in Carrizalejo, Sinaloa, two men were killed and their bodies were found with signs of torture and gunshot wounds near a pantheon on the road to Sanalona. 2 fatalities.",2,MX25006,Culiacán,2024-12-13,2025-12-13
MEX95599,2024-11-13,2024,Political violence,Violence against civilians,Attack,484,North America,Mexico,Sinaloa,Culiacan,Carrizalejo,24.8104,-107.2887,El Sol de Sinaloa; La Jornada; La Silla Rota,"Around 13 November 2024 (as reported), in Carrizalejo, Sinaloa, two men were killed and their bodies were found with signs of torture, their hands tied up, and wire around their neck. 2 fatalities.",2,MX25006,Culiacán,2024-12-13,2025-12-13
MEX100100,2024-10-16,2024,Political violence,Violence against civilians,Attack,484,North America,Mexico,México,Ocuilan,San Juan Atzingo,19.0107,-99.3851,Milenio,"On 16 October 2024, close to San Juan Atzingo, Mexico, armed men aboard a vehicle opened fire and shot at two men accused of illegal logging on the way to Lagunas de Zempuala (drive-by). 2 fatalities.",2,MX15063,Ocuilan,2024-12-13,2025-12-13
MEX94265,2024-10-15,2024,Political violence,Violence against civilians,Attack,484,North America,Mexico,Veracruz de Ignacio de la Llave,Orizaba,Orizaba,18.851,-97.0989,La Silla Rota,"Around 15 October 2024 (as reported), in Orizaba, Veracruz de Ignacio de la Llave, a woman was killed and her body was found mutilated in Colonia El Espinal. 1 fatality.",1,MX30118,Orizaba,2024-12-13,2025-12-13
MEX94500,2024-10-24,2024,Political violence,Violence against civilians,Attack,484,North America,Mexico,México,Chalco,San Marcos Huixtoco,19.2951,-98.8641,El Norte; La Jornada; Milenio,"Around 24 October 2024 (as reported), in the outskirts of San Marcos Huixtoco, Mexico, two people were killed and their bodies with their hands tied and gunshot wounds were found on a road leading to the community. A message signed by the CJNG was found next to the bodies. On 30 October 2024, six state police officers were arrested in the municipality of Chalco due to their suspected participation in this attack. 2 fatalities.",2,MX15025,Chalco,2024-12-13,2025-12-13
MEX94501,2024-10-24,2024,Political violence,Violence against civilians,Attack,484,North America,Mexico,México,Chalco,San Martin Cuautlalpan,19.2762,-98.8317,El Norte; El Universal (Mexico),"Around 24 October 2024 (as reported), in San Martin Cuautlalpan, Mexico, two men were killed and their bodies were found on a dirt road with their hands tied and decapitated behind fraccionamiento Los Heroes Tercera Seccion. A message was found signed by the CJNG. 2 fatalities.",2,MX15025,Chalco,2024-12-13,2025-12-13
MEX94649,2024-10-19,2024,Political violence,Violence against civilians,Attack,484,North America,Mexico,Veracruz de Ignacio de la Llave,Amatlan de los Reyes,Amatlan de los Reyes,18.8476,-96.9155,Imagen del Golfo,"Around 19 October 2024 (as reported), in Amatlan de los Reyes, Veracruz de Ignacio de la Llave, a person was killed and the body was found wrapped in blankets on a path that connects Paraje and Rio Seco. 1 fatality.",1,MX30014,Amatlán de los Reyes,2024-12-13,2025-12-13
MEX95221,2024-11-05,2024,Political violence,Violence against civilians,Sexual violence,484,North America,Mexico,Veracruz de Ignacio de la Llave,Cordoba,Cordoba,18.8944,-96.9353,Imagen del Golfo,"Around 5 November 2024 (between 3 - 8 November), in Cordoba, Veracruz de Ignacio de la Llave, a man was killed and his naked body was found on 8 November in an advanced state of decomposition, with signs of violence and the neck tied with branches at the bottom of a cliff in the community of Francisco I. Madero. The victim had disappeared on 3 November 2024. 1 fatality.",1,MX30044,Córdoba,2024-12-13,2025-12-13
MEX95327,2024-11-07,2024,Political violence,Violence against civilians,Abduction/forced disappearance,484,North America,Mexico,Veracruz de Ignacio de la Llave,Cordoba,Cordoba,18.8944,-96.9353,Imagen del Golfo,"On 7 November 2024, in Cordoba, Veracruz de Ignacio de la Llave, at least four armed individuals abducted a woman in the intersection of Libertad street and Union avenue, in Colonia Antorchista de Cordoba. The victim's whereabouts are unknown.",0,MX30044,Córdoba,2024-12-13,2025-12-13
MEX95507,2024-11-12,2024,Political violence,Battles,Armed clash,484,North America,Mexico,México,Ixtapaluca,Ixtapaluca,19.3131,-98.8842,Milenio,"On 12 November 2024, in Ixtapaluca, Mexico, armed individuals opened fire at municipal police officers on patrol. Two officers were injured as a result. 2 injuries.",0,MX15039,Ixtapaluca,2024-12-13,2025-12-13
MEX95631,2024-11-12,2024,Political violence,Violence against civilians,Attack,484,North America,Mexico,Sinaloa,Elota,El Espinal,24.1228,-106.8922,24 Horas (Mexico); Borderland Beat; Colima Noticias; Riodoce,"On 12 November 2024, in El Espinal, Sinaloa, armed individuals in two vehicles intercepted and kidnapped at the president of the Livestock Association of Coyotitan in Higueras de Abuya. He was killed and later his body was found with his eyes removed, his tongue cut out, and a message signed by a local commander of Los Chapos in El Espinal, in Elota. 1 fatality.",1,MX25008,Elota,2024-12-13,2025-12-13
MEX104667,2024-10-15,2024,Political violence,Violence against civilians,Abduction/forced disappearance,484,North America,Mexico,Sonora,Cajeme,Ciudad Obregon,27.4965,-109.9327,Entorno Informativo,"Around 15 October 2024 (month of), near Ciudad Obregon, Sonora, four individuals abducted a person who had just crossed into the country from the U.S. border and was driving to Ciudad Obregon. The perpetrators demanded a 10,000$ ramson to the victim's relatives, and released the victim near Cibuta when it was paid. A man linked to drug trafficking was arrested for participating in the abduction on 29 May 2025.",0,MX26018,Cajeme,2024-12-13,2025-12-13
MEX94136,2024-10-14,2024,Political violence,Violence against civilians,Abduction/forced disappearance,484,North America,Mexico,Veracruz de Ignacio de la Llave,Poza Rica de Hidalgo,Poza Rica de Hidalgo,20.5341,-97.4436,Imagen del Golfo; La Jornada; La Silla Rota,"On 14 October 2024, in Poza Rica de Hidalgo, Veracruz de Ignacio de la Llave, a group of armed men intercepted the Municipal Director of Civil Protection of the Poza Rica city council and abducted him. The victim was released around 18 October 2024.",0,MX30131,Poza Rica de Hidalgo,2024-12-13,2025-12-13
MEX95171,2024-11-04,2024,Political violence,Violence against civilians,Abduction/forced disappearance,484,North America,Mexico,Veracruz de Ignacio de la Llave,Poza Rica de Hidalgo,Poza Rica de Hidalgo,20.5341,-97.4436,Imagen del Golfo,"On 4 November 2024, in Poza Rica de Hidalgo, Veracruz de Ignacio de la Llave, unknown armed individuals kidnapped a City Hall employee assigned to the area of governance in the municipal administration when he was at a gas station. The whereabouts of the man remain unknown.",0,MX30131,Poza Rica de Hidalgo,2024-12-13,2025-12-13
MEX95326,2024-11-07,2024,Political violence,Violence against civilians,Attack,484,North America,Mexico,Veracruz de Ignacio de la Llave,Apazapan,Chahuapan,19.3475,-96.6839,Imagen del Golfo,"On 7 November 2024, in Chahuapan, Veracruz de Ignacio de la Llave, according to witnesses, armed individuals got off a van and a motorbike on Independencia street, took a man out of a house, and shot and killed him. According to a version, the victim is a relative of a municipal police officer, which is suspected to be related to this attack. 1 fatality.",1,MX30017,Apazapan,2024-12-13,2025-12-13
MEX100061,2024-10-15,2024,Political violence,Violence against civilians,Attack,484,North America,Mexico,Hidalgo,Atotonilco de Tula,Atotonilco de Tula,20.0078,-99.2202,Milenio,"On 15 October 2024, in Atotonilco de Tula, Hidalgo, three men shot and killed a man outside an Oxxo store in Colonia Senderos and then fled the scene. 1 fatality.",1,MX13013,Atotonilco de Tula,2024-12-13,2025-12-13
MEX100273,2024-10-27,2024,Political violence,Violence against civilians,Attack,484,North America,Mexico,Sinaloa,Culiacan,Eldorado,24.3228,-107.3629,Milenio,"Around 27 October 2024 (as reported), in Eldorado, Sinaloa, a man and a woman were killed and their bodies were found inside a room that is believed to be used for the sale of drugs in El Realito. 2 fatalities.",2,MX25006,Culiacán,2024-12-13,2025-12-13
MEX94153,2024-10-15,2024,Political violence,Battles,Armed clash,484,North America,Mexico,Guerrero,Ayutla de los Libres,Ayutla de los Libres,16.9653,-99.0974,La Silla Rota,"On 15 October 2024, in Ayutla de los Libres, Guerrero, an armed clash was reported between members of the UPOEG and another group, which is linked to the presence of a new group in the region. At least three people were killed, including the leader of the UPOEG. 3 fatalities.",3,MX12012,Ayutla de los Libres,2024-12-13,2025-12-13
MEX94227,2024-10-15,2024,Political violence,Violence against civilians,Attack,484,North America,Mexico,Guerrero,Ayutla de los Libres,Ayutla de los Libres,16.9653,-99.0974,La Silla Rota,"Around 15 October 2024 (as reported), in Ayutla de los Libres, Guerrero, one person was killed and the human remains were found inside a plastic bag. 1 fatality.",1,MX12012,Ayutla de los Libres,2024-12-13,2025-12-13
