event_id_cnty,event_date,year,disorder_type,event_type,sub_event_type,iso,region,country,admin1,admin2,location,latitude,longitude,source,notes,fatalities,adm2_code,adm2_name,data_as_of,run_date
MEX95369,2024-11-08,2024,Political violence,Violence against civilians,Attack,484,North America,Mexico,Tamaulipas,Reynosa,El Guerreno,26.0281,-98.1973,Hoy Tamaulipas,"Around 8 November 2024 (as reported), in El Guerreno, Tamaulipas, armed individuals on a van shot at two people that were changing a wheel of a vehicle on Rio Bravo-Reynosa road, killing a woman and injuring a man (drive-by). The perpetrators suspectedly mistook the victims for members of rival organizations. 1 fatality, 1 injured.",1,MX28032,Reynosa,2024-12-13,2025-12-13
MEX95370,2024-11-08,2024,Political violence,Battles,Armed clash,484,North America,Mexico,Tamaulipas,Rio Bravo,Ciudad Rio Bravo,25.981,-98.0901,Hoy Tamaulipas,"Around 8 November 2024 (as reported), in Ciudad Rio Bravo, Tamaulipas, armed groups clashed and an unknown number of people were killed. One of the people involved in the clash fled the scene and sought medical assistance in Colonia Las Cumbres, where he was arrested. Unspecified number of fatalities coded as 3.",3,MX28033,Río Bravo,2024-12-13,2025-12-13
MEX95372,2024-11-10,2024,Political violence,Violence against civilians,Abduction/forced disappearance,484,North America,Mexico,Baja California,Mexicali,Los Algodones,32.7133,-114.7358,Zeta Tijuana,"On 10 November 2024, in Los Algodones, Baja California, four people were kidnapped by unidentified armed individuals. Two of them were later found alive. The other two are suspected to be found killed, however, this was not confirmed. The whereabouts of the other two people remain unknown.",0,MX02002,Mexicali,2024-12-13,2025-12-13
MEX95374,2024-11-08,2024,Political violence,Violence against civilians,Attack,484,North America,Mexico,Baja California,Tijuana,Tijuana,32.5325,-117.019,Zeta Tijuana,"Around 8 November 2024 (as reported), in Tijuana, Baja California, a woman was killed and her burnt body was found on 5 street, in Colonia Jardines de las Cruces, in the Delegation of San Antonio de los Buenos. 1 fatality.",1,MX02004,Tijuana,2024-12-13,2025-12-13
MEX95375,2024-11-09,2024,Political violence,Violence against civilians,Attack,484,North America,Mexico,Baja California,Tijuana,Tijuana,32.5325,-117.019,Zeta Tijuana,"Around 9 November 2024 (as reported), in Tijuana, Baja California, a man was killed and his head was found in Colonia Kino II. 1 fatality.",1,MX02004,Tijuana,2024-12-13,2025-12-13
MEX95376,2024-11-10,2024,Political violence,Violence against civilians,Attack,484,North America,Mexico,Baja California,Tijuana,Tijuana,32.5325,-117.019,AFN - Tijuana,"Around 10 November 2024 (as reported), in Tijuana, Baja California, a person was killed and the body was found with gunshot wounds and the hands tied on Santo Degollado and 5 de Febrero streets, in Colonia Ninos Heroes. 1 fatality.",1,MX02004,Tijuana,2024-12-13,2025-12-13
MEX95377,2024-11-11,2024,Political violence,Violence against civilians,Attack,484,North America,Mexico,Baja California,Tijuana,Tijuana,32.5325,-117.019,Zeta Tijuana,"Around 11 November 2024 (as reported), in Tijuana, Baja California, according to witnesses, a group of armed men shot and killed a man in Colonia Chihuahua, and then fled in two vehicles. 1 fatality.",1,MX02004,Tijuana,2024-12-13,2025-12-13
MEX95381,2024-11-13,2024,Political violence,Violence against civilians,Attack,484,North America,Mexico,Baja California,Tijuana,Tijuana,32.5325,-117.019,AFN - Tijuana,"On 13 November 2024, in Tijuana, Baja California, according to witnesses, armed men shot and killed a man in Colonia Rancho las Flores. 1 fatality.",1,MX02004,Tijuana,2024-12-13,2025-12-13
MEX95391,2024-11-12,2024,Political violence,Violence against civilians,Attack,484,North America,Mexico,Campeche,Campeche,San Francisco de Campeche,19.8448,-90.5396,Tribuna Campeche,"On 12 November 2024, in San Francisco de Campeche, Campeche, two armed men on a motorcycle shot and injured two men in a drive-by shooting in the Unidad habitacional Fidel Velazquez.",0,MX04002,Campeche,2024-12-13,2025-12-13
MEX95396,2024-11-13,2024,Political violence,Battles,Armed clash,484,North America,Mexico,Campeche,Champoton,Seybaplaya,19.6411,-90.6856,Tribuna Campeche,"Around 13 November 2024 (as reported), in Seybaplaya, Campeche, a man was killed and the body was found with the 'tiro de gracia'. The victim was a drug dealer. 1 fatality.",1,MX04004,Champotón,2024-12-13,2025-12-13
MEX95397,2024-11-10,2024,Political violence,Violence against civilians,Attack,484,North America,Mexico,Campeche,Escarcega,Escarcega,18.6065,-90.738,Tribuna Campeche,"On 10 November 2024, in Escarcega, Campeche, an armed individual on a motorbike shot at a person who was driving a bicycle in front of Abelardo Carrillo Zavala park (drive-by). The victim was uninjured. Also in Escarcega, armed individuals on a taxi shot at a person who was driving a motorcycle in Colonia Concordia (drive-by). The victim tried to flee, and it is unknown whether he was injured. The perpetrators followed him to his house, and shot at the house facade causing damages.",0,MX04009,Escárcega,2024-12-13,2025-12-13
MEX95407,2024-11-13,2024,Political violence,Violence against civilians,Attack,484,North America,Mexico,Chihuahua,Aldama,Juan Aldama,28.8384,-105.9113,La Jornada; Tiempo,"On 13 November 2024, in Juan Aldama, Chihuahua, two men were shot and killed suspectedly by members of criminal group while driving in colonia El Arbolito. 2 fatalities.",2,MX08002,Aldama,2024-12-13,2025-12-13
MEX95410,2024-11-10,2024,Political violence,Violence against civilians,Attack,484,North America,Mexico,Chihuahua,Chihuahua,Chihuahua,28.6368,-106.0763,Tiempo,"On 10 November 2024, in Chihuahua, Chihuahua, two armed individuals shot and killed a man that was driving a van on Mina San Rafael and Mina La Negrita streets, in Colonia Robinson. 1 fatality.",1,MX08019,Chihuahua,2024-12-13,2025-12-13
MEX95411,2024-11-13,2024,Political violence,Violence against civilians,Attack,484,North America,Mexico,Chihuahua,Chihuahua,Chihuahua,28.6368,-106.0763,La Jornada; Tiempo,"Around 13 November 2024 (as reported), in Chihuahua, Chihuahua, three men were killed and their bodies were found with their hands and feet tied up around Granjas del Valle near Libramiento Oriente. 3 fatalities.",3,MX08019,Chihuahua,2024-12-13,2025-12-13
MEX95422,2024-11-09,2024,Political violence,Violence against civilians,Attack,484,North America,Mexico,Ciudad de Mexico,Tlalpan,Ciudad de Mexico - Tlalpan,19.2883,-99.1671,Diario de Morelos; Milenio,"On 9 November 2024, in Ciudad de Mexico - Tlalpan, a group of armed individuals shot at four people around km. 28 of Mexico-Cuernavaca federal road near San Miguel Topilejo, killing a man and injuring three other people (likely witnesses). 1 fatality, 3 injured.",1,MX09012,Tlalpan,2024-12-13,2025-12-13
MEX95423,2024-11-13,2024,Political violence,Battles,Armed clash,484,North America,Mexico,Ciudad de Mexico,Venustiano Carranza,Ciudad de Mexico - Venustiano Carranza,19.4193,-99.1137,Milenio,"On 13 November 2024, in Ciudad de Mexico - Venustiano Carranza, armed men on a motorcycle shot and killed (drive-by) a man and injured another one in colonia Penitenciaria. The killed victim was identified as a drug dealer. 1 fatality.",1,MX09017,Venustiano Carranza,2024-12-13,2025-12-13
MEX95437,2024-11-12,2024,Political violence,Violence against civilians,Attack,484,North America,Mexico,Guanajuato,Celaya,Celaya,20.5215,-100.814,Zona Franca,"On 12 November 2024, in Celaya, Guanajuato, according to witnesses, an armed man shot and killed a man in a mall. The perpetrator ran away with his accomplice on a motorcycle. Also in Celaya, two armed men entered a house and killed a man in Colonia Ejidal. In a third attack in Celaya, at least two armed individuals who arrived on a motorcycle shot and killed a man in colonia Arboledas de San Rafael. A woman was also injured. 3 fatalities.",3,MX11007,Celaya,2024-12-13,2025-12-13
MEX95438,2024-11-13,2024,Political violence,Violence against civilians,Attack,484,North America,Mexico,Guanajuato,Celaya,Celaya,20.5215,-100.814,La Silla Rota,"On 13 November 2024, in Celaya, Guanajuato, two armed men shot and killed a couple in front of their 5-year-old daughter in Colonia La Alameda. 2 fatalities.",2,MX11007,Celaya,2024-12-13,2025-12-13
MEX95440,2024-11-10,2024,Political violence,Violence against civilians,Attack,484,North America,Mexico,Guanajuato,Leon,Capellania de Loera,21.0382,-101.5961,Zona Franca,"On 10 November 2024, in Capellania de Loera, Guanajuato, four armed men on a vehicle shot at a van on km. 5 of Maxipista Leon-Aguascalientes, killing a woman and injuring six other people, including two minors (drive-by). The victims are members of the same family. 1 fatality, 6 injured.",1,MX11020,León,2024-12-13,2025-12-13
MEX95449,2024-11-08,2024,Political violence,Violence against civilians,Attack,484,North America,Mexico,Guanajuato,Romita,El Jaguey,20.9148,-101.6339,Zona Franca,"Around 8 November 2024 (as reported), in El Jaguey, Guanajuato, a man was killed and his body was found semi-buried and with tape around one of the hands, between the communities of Barretos and Nuevo Lindero. 1 fatality.",1,MX11026,Romita,2024-12-13,2025-12-13
MEX95463,2024-10-27,2024,Political violence,Violence against civilians,Abduction/forced disappearance,484,North America,Mexico,Guerrero,Chilpancingo de los Bravo,Chilpancingo de los Bravo,17.5516,-99.5011,La Silla Rota,"On 27 October 2024, in Chilpancingo de los Bravo, Guerrero, a merchant was kidnapped by members of Los Ardillos gang from Petaquillas. He later was released and made a declaration to the authorities, where he accused a politician and the gang of being involved in the killing of the recent elected mayor (coded separately). The merchant was later killed and his body was found on 6 November (coded separately).",0,MX12029,Chilpancingo de los Bravo,2024-12-13,2025-12-13
MEX95464,2024-11-06,2024,Political violence,Violence against civilians,Attack,484,North America,Mexico,Guerrero,Chilpancingo de los Bravo,Chilpancingo de los Bravo,17.5516,-99.5011,La Silla Rota,"Around 6 November 2024 (as reported), in Chilpancingo de los Bravo, Guerrero, a merchant was killed by members of Los Ardillos gang and his body was found. The victim had been previously abducted by this gang and during his captivity heard information about the involvement of the gang in the killing of the elected mayor (coded separately). After having shared the information he heard with the police, he was killed. 1 fatality.",1,MX12029,Chilpancingo de los Bravo,2024-12-13,2025-12-13
MEX95465,2024-11-08,2024,Political violence,Violence against civilians,Attack,484,North America,Mexico,Guerrero,Chilpancingo de los Bravo,Chilpancingo de los Bravo,17.5516,-99.5011,El Sol de Acapulco,"Around 8 November 2024 (as reported), in Chilpancingo de los Bravo, Guerrero, a man was killed and his body was found with gunshot wounds in the head in Colonia Jardines de Zinnia. The victim was a former bodyguard for public servants, a former ministerial federal police officer, and current leader of 'La Basura Jefa', an association of over 200 particular garbage collectors. 1 fatality.",1,MX12029,Chilpancingo de los Bravo,2024-12-13,2025-12-13
MEX95474,2024-11-12,2024,Political violence,Violence against civilians,Attack,484,North America,Mexico,Guerrero,Coyuca de Benitez,El Cayaco,17.0472,-100.2682,El Sol de Acapulco,"On 12 November 2024, in El Cayaco, Guerrero, armed individuals in a vehicle shot and killed a woman in a drive-by shooting on the Acapulco-Pinotepa Nacional. The woman was driving and crashed after being shot at. 1 fatality.",1,MX12021,Coyuca de Benítez,2024-12-13,2025-12-13
MEX95483,2024-11-13,2024,Political violence,Violence against civilians,Attack,484,North America,Mexico,Hidalgo,Tulancingo de Bravo,Tulancingo,20.0806,-98.3681,Milenio,"Around 13 November 2024 (as reported), in Tulancingo, Hidalgo, two people were killed and their bodies were found burned in an empty lot in colonia Ahuehuetitla. 2 fatalities.",2,MX13077,Tulancingo de Bravo,2024-12-13,2025-12-13
MEX95490,2024-11-09,2024,Political violence,Violence against civilians,Attack,484,North America,Mexico,Jalisco,San Pedro Tlaquepaque,Tlaquepaque,20.6386,-103.3072,Mural,"Around 9 November 2024 (as reported), in Tlaquepaque, Jalisco, a man was killed and his body was found wrapped in plastic bags on Agua Dulce street, in Colonia Loma Linda. 1 fatality.",1,MX14098,San Pedro Tlaquepaque,2024-12-13,2025-12-13
MEX95493,2024-11-12,2024,Political violence,Battles,Armed clash,484,North America,Mexico,Jalisco,Teocaltiche,Mechoacanejo,21.5404,-102.5959,El Universal (Mexico); La Verdad,"On 12 November 2024, in Mechoacanejo, Jalisco, a commando of the Jalisco New Generation Cartel (CJNG) broke into the community and clashed with armed residents who tried to stop their entrance. This event was part of other events involving the CJNG in the municipality (coded separately). The CJNG also blocked the roads with vehicles and set them on fire to set a (narco) roadblock. Casualties unknown.",0,MX14091,Teocaltiche,2024-12-13,2025-12-13
MEX95494,2024-11-08,2024,Political violence,Violence against civilians,Attack,484,North America,Mexico,Jalisco,Tlajomulco de Zuniga,Tlajomulco de Zuniga,20.4736,-103.4431,Mural,"Around 8 November 2024 (as reported), in Tlajomulco de Zuniga, Jalisco, a man was killed and his body was found with stab wounds and the hands tied on a path near the intersection of Villa Lisboa and Villa Oporto streets, in Fraccionamiento Villa Fontana Aqua. 1 fatality.",1,MX14097,Tlajomulco de Zúñiga,2024-12-13,2025-12-13
MEX95495,2024-11-12,2024,Political violence,Violence against civilians,Attack,484,North America,Mexico,Jalisco,Tlajomulco de Zuniga,Tlajomulco de Zuniga,20.4736,-103.4431,Milenio,"Around 12 November 2024 (as reported), in Tlajomulco de Zuniga, Jalisco, a man was killed and the body was found inside a mattress in fraccionamiento Canadas del Bosque. 1 fatality.",1,MX14097,Tlajomulco de Zúñiga,2024-12-13,2025-12-13
MEX95498,2024-11-09,2024,Political violence,Violence against civilians,Attack,484,North America,Mexico,Jalisco,Zapopan,Zapopan,20.7206,-103.3883,Mural,"On 9 November 2024, in Zapopan, Jalisco, armed individuals on motorbikes shot and injured two people (a man and a woman) on 2 street, in Lomas del Vergel (drive-by). 2 injured.",0,MX14120,Zapopan,2024-12-13,2025-12-13
MEX95502,2024-11-11,2024,Political violence,Violence against civilians,Attack,484,North America,Mexico,México,Chicoloapan,Chicoloapan de Juarez,19.4168,-98.902,La Jornada,"On 11 November 2024, in Chicoloapan de Juarez, Mexico, a young man was shot and injured by four armed young men in street Real de Aguascalientes Unidad Habitacional Ara 3.",0,MX15029,Chicoloapan,2024-12-13,2025-12-13
MEX95514,2024-11-11,2024,Political violence,Violence against civilians,Attack,484,North America,Mexico,Michoacán,Alvaro Obregon,Alvaro Obregon,19.8263,-101.0385,La Voz de Michoacan,"Around 11 November 2024 (as reported), in Alvaro Obregon, Michoacan de Ocampo, two people (a man and a woman) were killed and their bodies were found with gunshot wounds and wrapped in blankets in a field next to Ramal El Venado path and a bridge on Morelia-Aeropuerto highway. 2 fatalities.",2,MX16003,Álvaro Obregón,2024-12-13,2025-12-13
MEX95522,2024-11-10,2024,Political violence,Violence against civilians,Attack,484,North America,Mexico,Michoacán,Zamora,Zamora de Hidalgo,19.9836,-102.286,La Voz de Michoacan,"On 10 November 2024, in Zamora de Hidalgo, Michoacan de Ocampo, armed individual(s) shot and killed an off-duty traffic municipal police officer who was driving a motorcycle on Paseo de Altamira avenue, in Fraccionamiento Altamira. The victim's son was on the vehicle and was injured. 1 fatality, 1 injured.",1,MX16108,Zamora,2024-12-13,2025-12-13
MEX95525,2024-11-09,2024,Political violence,Violence against civilians,Attack,484,North America,Mexico,Morelos,Cuautla,Cuautla,18.8128,-98.9553,Diario de Morelos; Reforma,"On 9 November 2024, in Cuautla, Morelos, according to witnesses, over ten hooded armed men entered a house on Matamoros street, in Colonia Miguel Hidalgo, and shot at people that were celebrating a baptism, injuring at least three. A version indicate that the perpetrators beat and robbed some of the victims. The perpetrators fled in two vehicles. 3 injured.",0,MX17006,Cuautla,2024-12-13,2025-12-13
MEX95527,2024-11-10,2024,Political violence,Violence against civilians,Attack,484,North America,Mexico,Morelos,Cuernavaca,Cuernavaca,18.9218,-99.2349,Diario de Morelos,"On 10 November 2024, in Cuernavaca, Morelos, according to security cameras recordings, armed individuals on a motorbike shot at a vehicle on Castillo de Chapultepec avenue, injuring two men (drive-by). 2 injured.",0,MX17007,Cuernavaca,2024-12-13,2025-12-13
MEX95533,2024-11-12,2024,Political violence,Battles,Armed clash,484,North America,Mexico,Nayarit,Xalisco,Xalisco,21.4437,-104.8997,El Universal (Mexico),"On 12 November 2024, in Xalisco, Nayarit, officers of the investigative police (ministerial police) went to a home in Fraccionamiento Canoas II upon suspicion of the sale of drugs and a man opened fire at them when they were at the drop and a clash ensued. One police officer was injured as a result and the suspected drug dealer escaped. 1 injury.",0,MX18008,Xalisco,2024-12-13,2025-12-13
MEX95534,2024-11-13,2024,Political violence,Battles,Armed clash,484,North America,Mexico,Nayarit,Xalisco,Xalisco,21.4437,-104.8997,El Universal (Mexico),"On 13 November 2024, I Xalisco, Mexico, ministerial police officers supporter by officers from different state departments went to a home upon suspecting the presence of an armed man who shot two police officers the day before (coded separately). The man who was a suspected drug dealer shot at the police officers who repelled the aggression and killed him. 1 fatality.",1,MX18008,Xalisco,2024-12-13,2025-12-13
MEX95538,2024-11-12,2024,Political violence,Violence against civilians,Attack,484,North America,Mexico,Nuevo León,Cienega de Flores,Cienega de Flores,25.9521,-100.1681,Milenio,"On 12 November 2024, in Cienega de Flores, Nuevo Leon, several armed men shot and injured a man in Colonia Paseos del Roble. The event could be related to drug dealing as drugs were found by the side of the crime scene.",0,MX19012,Ciénega de Flores,2024-12-13,2025-12-13
MEX95539,2024-11-11,2024,Political violence,Violence against civilians,Attack,484,North America,Mexico,Nuevo León,El Carmen,Carmen,25.9322,-100.3641,Milenio,"Around 11 November 2024 (between 10 - 13 November), in Carmen, Nuevo Leon, a couple was killed and their bodies were found on 13 November in a house in fraccionamiento Antares wrapped in plastic bags. Both victims were reported missing on 10 November. 2 fatalities.",2,MX19010,El Carmen,2024-12-13,2025-12-13
MEX95545,2024-11-09,2024,Political violence,Battles,Armed clash,484,North America,Mexico,Nuevo León,General Teran,San Pedro,25.2755,-99.6417,La Verdad; Milenio,"On 9 November 2024, in San Pedro, Nuevo Leon, municipal police officers and armed individuals clashed on the road to the village of Santa Ana Nuevo. Three armed individuals died and an officer was injured. Three women were also collaterally injured. Officers seized several fireweapons and four vehicles. 3 fatalities, 4 injured.",3,MX19022,General Terán,2024-12-13,2025-12-13
MEX95558,2024-11-09,2024,Political violence,Violence against civilians,Attack,484,North America,Mexico,Oaxaca,Heroica Ciudad de Juchitan de Zaragoza,Juchitan de Zaragoza,16.4333,-95.0216,Quadratin Oaxaca,"Around 9 November 2024 (as reported), in Juchitan de Zaragoza, Oaxaca, a man was killed and his body was found with the hands tied. The victim suspectedly is a man who was abducted during an attack on 8 November 2024, in which another person was killed (unclear circumstances). 1 fatality.",1,MX20043,Heroica Ciudad de Juchitán de Zaragoza,2024-12-13,2025-12-13
MEX95562,2024-11-11,2024,Political violence,Violence against civilians,Attack,484,North America,Mexico,Oaxaca,Putla Villa de Guerrero,Putla Villa de Guerrero,17.0262,-97.9282,El Siglo de Durango; La Jornada; Quadratin Oaxaca,"On 11 November 2024, in Putla Villa de Guerrero, Oaxaca, a member of the Movement of Triqui Unification and Struggle (MULT) from the Mixtec Indigenous Group was killed by unidentified armed individuals. Representatives of the MULT condemned the attack and denounced the targeted attacks against members of this community, including the killing of two activist sisters (coded separately). 1 fatality.",1,MX20073,Putla Villa de Guerrero,2024-12-13,2025-12-13
MEX95563,2024-11-12,2024,Political violence,Violence against civilians,Attack,484,North America,Mexico,Oaxaca,San Juan Bautista Tuxtepec,San Juan Bautista Tuxtepec,18.0812,-96.1185,Quadratin Oaxaca,"Around 12 November 2024 (as reported), in San Juan Bautista Tuxtepec, Oaxaca, a man was killed and the body was found inside a barrel with his hands tied up and signs to be burned with acid. 1 fatality.",1,MX20184,San Juan Bautista Tuxtepec,2024-12-13,2025-12-13
MEX95564,2024-11-09,2024,Political violence,Violence against civilians,Attack,484,North America,Mexico,Oaxaca,San Lorenzo Cacaotepec,San Lorenzo Cacaotepec,17.1278,-96.8017,Quadratin Oaxaca,"Around 9 November 2024 (as reported), in San Lorenzo Cacaotepec, Oaxaca, a person was killed and the body was found inside a plastic bag. 1 fatality.",1,MX20227,San Lorenzo Cacaotepec,2024-12-13,2025-12-13
MEX95567,2024-11-10,2024,Political violence,Violence against civilians,Attack,484,North America,Mexico,Puebla,Chiautla,Ciudad de Chiautla de Tapia,18.2997,-98.6028,E-Consulta; Milenio,"On 10 November 2024, in Ciudad de Chiautla de Tapia, Puebla, several armed individuals on a vehicle shot and killed a man near a bridge in San Miguel neighborhood (drive-by). The victim was the brother of a PAN candidate for the municipal presidency who was abducted, tortured, and killed on 13 July 2023 (coded separately). Their father was also killed on 6 May 2024 (coded separately). 1 fatality.",1,MX21047,Chiautla,2024-12-13,2025-12-13
MEX95574,2024-11-10,2024,Political violence,Battles,Armed clash,484,North America,Mexico,Puebla,Puebla,Heroica Puebla de Zaragoza,19.044,-98.1975,Milenio,"On 10 November 2024, in Heroica Puebla de Zaragoza, Puebla, state and municipal police officers chased and clashed with armed individuals along Periferico Ecologico area. The armed individuals crashed their vehicle and were arrested. There were no casualties.",0,MX21114,Puebla,2024-12-13,2025-12-13
MEX95575,2024-11-11,2024,Political violence,Violence against civilians,Attack,484,North America,Mexico,Puebla,Puebla,Heroica Puebla de Zaragoza,19.044,-98.1975,E-Consulta,"On 11 November 2024, in Heroica Puebla de Zaragoza, Puebla, according to the witness victim's partner, armed individuals on a vehicle shot and killed a man who was driving a van on Valsequillo boulevard, by the entry to Fraccionamiento Santo Tomas 4 (drive-by). 1 fatality.",1,MX21114,Puebla,2024-12-13,2025-12-13
MEX95576,2024-11-12,2024,Political violence,Violence against civilians,Attack,484,North America,Mexico,Puebla,Puebla,Heroica Puebla de Zaragoza,19.044,-98.1975,E-Consulta,"On 12 November 2024, in Heroica Puebla de Zaragoza, Puebla, eight armed men shot at a couple who were driving a vehicle. A man was injured and taken to the hospital. He died due to the injuries. 1 fatality.",1,MX21114,Puebla,2024-12-13,2025-12-13
MEX95579,2024-11-13,2024,Political violence,Violence against civilians,Attack,484,North America,Mexico,Puebla,Puebla,Santa Maria Xonacatepec,19.0873,-98.1036,Milenio,"Around 13 November 2024 (as reported), in Santa Maria Xonacatepec, Puebla, a person was killed and the body was found wrapped in a plastic inside a ravine near La Resurreccion. 1 fatality.",1,MX21114,Puebla,2024-12-13,2025-12-13
MEX95580,2024-11-11,2024,Political violence,Violence against civilians,Attack,484,North America,Mexico,Puebla,Tehuacan,Tehuacan,18.4622,-97.392,E-Consulta; Milenio,"On 11 November 2024, in Tehuacan, Puebla, according to witnesses, two armed individuals on a motorbike shot and killed an employee of the Tehuacan Drinking Water and Sewage Service Operating Agency (Oosapat) who was inspecting a well between Tonala and 19 Poniente streets and Arenas avenue in Fraccionamiento Xochipilli, in front of a municipal pantheon (drive-by). 1 fatality.",1,MX21156,Tehuacán,2024-12-13,2025-12-13
MEX95584,2024-11-09,2024,Political violence,Violence against civilians,Attack,484,North America,Mexico,Puebla,Tochtepec,Tochtepec,18.8393,-97.8228,E-Consulta,"On 9 November 2024, in Tochtepec, Puebla, armed individuals in a van shot at a vehicle on La Colorada-Tepexi de Rodriguez state road, between San Lorenzo Ometepec and Santa Ana Coapan, killing a man and injuring two others (drive-by). 1 fatality, 2 injured.",1,MX21189,Tochtepec,2024-12-13,2025-12-13
MEX95593,2024-11-09,2024,Political violence,Violence against civilians,Attack,484,North America,Mexico,Sinaloa,Angostura,Leopoldo Sanchez Celis,25.1254,-108.0138,El Sol de Sinaloa,"Around 9 November 2024 (as reported), in Leopoldo Sanchez Celis, Sinaloa, a man was killed and his body was found with signs of torture on a side of the road that connects Eldorado and Culiacan. 1 fatality.",1,MX25002,Angostura,2024-12-13,2025-12-13
